"8303","Armored or reinforced safes, strong-boxes and doors and safe deposit lockers for strong-rooms, cash or deed boxes and the like, and parts thereof, of base metal","0.9877","0.6915","0.6722","0.7657","0.3043","0.3774","0.4897","0.3382","0.5659","0.6378","0.6434","0.5675","0.5946","0.4614","0.334","0.6735","0.4618","0.5465","0.5807","0.472","0.2095","0.2753","0.4263","0.3233","0.3269"
"8304","Desk-top filing or card-index cabinets, paper trays, paper rests, pen trays, office-stamp stands and similar office or desk equipment and parts thereof, of base metal, other than office furniture of heading 9403","0.3336","0.0851","-0.1063","0.3006","0.7387","0.0377","0.1034","0.0123","-0.1793","-0.146","0.1452","0.2107","0.0292","-0.2368","-0.2842","-0.317","-0.2003","-0.1886","0.2983","-0.6595","0.2125","-0.0672","-0.2838","0.6604","-0.1751"
"8305","Fittings for looseleaf binders or files, letter clips, letter corners, paper clips,indexing tags and similar office articles, and parts thereof, of base metal; staples in strips (for example, for offices, upholstery, packaging), of base metal","0.9553","0.8177","0.8404","0.504","0.7718","0.7075","0.6814","0.8811","0.4181","0.7582","0.7154","0.3459","0.8172","0.8839","0.1743","0.366","0.4356","0.9706","0.3943","0.5393","0.5483","0.4373","0.1793","0.3488","0.2024"
"8306","Bells, gongs and the like, nonelectric, of base metal; statuettes and other ornaments, of base metal; photograph, picture or similar frames, of base metal; mirrors of base metal; and base metal parts thereof","0.0726","-0.6675","-0.7348","-0.4768","-0.4245","-0.4749","-0.4224","-0.3636","-0.8061","-0.5441","-0.5861","-0.6589","-0.6442","-0.449","-0.8684","-0.5765","-0.3204","-0.5869","-0.368","-0.7267","-1.0409","-0.9748","-0.9653","-0.5446","-0.7098"
"8307","Flexible tubing of base metal,with or without fittings","0.5122","0.4562","0.9583","0.5235","0.6535","0.854","0.8264","0.5534","0.6488","0.9701","0.7072","0.167","1.1222","0.7384","0.9275","0.924","0.6296","0.6359","0.462","0.9173","1.0553","0.6109","0.7203","0.9237","2.0777"
"8308","Clasps, frames with clasps, buckles, buckle clasps, hooks, eyes, eyelets and the like and parts thereof, of base metal, of a kind used for clothing, footwear, awnings, handbags,travel goods or other made up articles; tubular or bifurcated rivets of base m","0.6797","0.6164","0.531","0.8809","0.5753","0.4072","0.3443","0.321","0.6268","0.3654","0.4492","0.6431","0.6405","0.2853","0.6896","0.5972","0.8423","0.5199","0.2638","0.8377","-0.087","0.0329","-0.0045","-0.2228","-0.1723"
"8309","Stoppers, caps and lids (including crown corks, screw caps and pouring stoppers),capsules for bottles, threaded bungs, bung covers, seals and other packing accessories, and parts thereof, of base metal","0.0371","0.1636","0.1345","0.3722","0.3679","0.0512","0.119","0.0541","0.1329","0.3596","-0.1359","0.4109","0.2326","0.3372","0.21","0.3656","0.5916","0.4972","0.1705","0.1147","0.1665","0.2142","0.0802","0.2228","0.0928"
"8310","Sign plates, name plates, address plates and similar plates, numbers, letters and other symbols, and parts thereof, of base metal, excluding those of heading 9405","0.6126","-0.2169","0.428","0.3037","0.3854","0.4837","0.6419","0.7021","0.62","0.5355","0.4458","0.3822","0.3506","0.872","0.7082","0.5458","0.772","0.409","0.3377","0.3993","0.6583","0.651","0.7551","0.09","0.263"
"8311","Wire, rods, tubes, plates, electrodes and similar products of base metal or of metal carbides,coated or cored with flux material, of a kind used for soldering, brazing, welding or deposition of metal or of metal carbides; wire and rods, of agglomerated ba","0.708","0.594","0.5617","0.5433","0.5671","0.6177","0.1662","0.4055","0.6737","0.6692","0.6491","0.8202","0.9415","0.5539","0.7399","0.6184","0.686","0.3877","0.5001","0.6114","0.6716","0.5511","0.5052","0.3954","0.463"
"8401","Nuclear reactors; fuel elements (cartridges), non-irradiated, for nuclear reactors; machinery and apparatus for isotopic separation; parts thereof","1.2295","0.6173","1.4555","1.2873","1.2499","1.2667","1.3104","1.215","1.0327","1.6045","1.4196","1.3363","1.6611","1.7547","1.4283","1.6476","2.0062","1.7966","1.6943","1.8374","1.7684","1.8008","1.2788","1.3486","1.6541"
"8402","Steam or other vapor generating boilers (other than central heating hot water boilers capable also of producing low pressure steam); super-heated water boilers; parts thereof","0.6045","0.8261","0.6522","0.3631","0.1584","0.6085","0.687","0.4264","0.6328","0.5846","0.7412","0.5551","0.6084","0.3091","0.7242","0.3465","0.4296","0.5092","0.8968","0.5636","1.1172","1.1107","1.0314","0.837","0.2431"
"8403","Central heating boilers (other than those of heading 8402) and parts thereof","1.1042","0.9904","1.089","0.7436","0.8205","1.0104","0.7951","0.9875","0.9488","1.0414","0.8706","0.9417","0.9826","1.0211","0.8806","0.866","0.6828","0.8565","0.4741","0.7818","1.1534","1.4854","1.3144","1.6978","1.3062"
"8404","Auxiliary plant for use with boilers of heading 8402 or 8403 (for example, economizers, super-heaters, soot removers, gas recoverers); condensers for steam or other vapor power units; parts thereof","0.7572","0.7632","0.9831","0.513","0.6397","0.5484","0.9318","0.7663","0.8996","0.5454","0.2714","0.6704","0.8982","1.1267","0.954","1.1712","0.8369","0.3184","0.45","0.4375","0.5844","0.6819","0.6968","0.9634","1.3185"
"8405","Producer gas or water gas generators, with or without their purifiers; acetylene gas generators and similar water process gas generators, with or without their purifiers; parts thereof","0.7773","0.4805","0.1782","0.7444","0.4075","0.3987","-0.1272","0.3651","0.3997","0.2459","0.3122","0.0307","0.4988","0.2166","0.7782","0.2868","0.1893","0.6347","0.6818","-0.1788","0.6257","0.5556","0.5309","0.4575","0.507"
"8406","Steam turbines and other vapor turbines, and parts thereof","0.9736","0.9215","1.0707","0.7443","1.2895","1.0805","1.6602","1.5918","1.5596","1.4035","0.8462","1.356","1.6745","1.3422","1.4111","1.0729","0.5966","0.9984","0.9535","1.256","1.1755","1.0897","1.1127","1.0569","1.2756"
"8407","Spark-ignition reciprocating or rotary internal combustion piston engines","1.203","0.9223","1.2762","0.8442","0.8391","1.2277","0.838","1.2418","1.2802","1.0799","0.5443","1.023","1.1514","1.1899","1.1786","1.4865","1.3908","1.1766","1.3587","1.1977","1.1258","1.339","1.0158","1.3021","0.6744"
"8408","Compression-ignition internal combustion piston engines (diesel or semi-diesel engines)","1.387","1.4313","1.6414","1.5052","1.5924","1.6109","1.6032","1.8494","1.5926","1.8567","1.916","1.4893","1.6225","1.7831","1.6465","1.4766","1.7276","1.7513","1.6796","1.6494","1.6214","1.7203","1.3068","1.8117","1.8697"
"8409","Parts suitable for use solely or principally with the engines of heading 8407 or 8408","1.0323","1.1755","1.0933","1.0854","1.0617","1.2825","1.4351","1.4824","1.2581","1.1225","1.038","1.0444","1.3386","1.3524","1.2024","1.2727","1.0782","1.0446","0.8298","0.8986","0.7549","0.7408","1.0943","1.1871","1.2813"
"8410","Hydraulic turbines, water wheels and regulators therefor; parts thereof","-0.2211","-0.0229","0.3907","0.2981","0.4858","0.804","0.2361","0.0031","-0.4204","0.0931","0.4624","0.6756","0.6954","0.858","0.6814","0.1955","0.7451","0.6075","0.73","0.6959","0.4648","0.2029","0.6827","0.8769","0.6046"
"8411","Turbojets, turbo propellers and other gas turbines, and parts thereof","0.7027","0.8507","0.8491","1.1908","0.8778","1.4685","0.7845","1.1275","0.6307","0.8752","1.4611","1.3999","0.7186","0.866","0.9094","0.3992","0.563","0.8908","1.0946","0.4551","0.9929","-0.1422","0.5023","-0.0437","0.3857"
"8412","Other engines and motors, and parts thereof","0.7768","1.455","1.1392","1.0482","0.8108","1.2356","1.1218","0.9513","1.1731","1.2041","0.5344","1.2102","1.0983","1.3966","1.3299","1.1996","1.1269","0.9539","0.9203","1.0167","1.0983","1.1804","0.9778","1.5498","1.3326"
"8413","Pumps for liquids, whether or not fitted with a measuring device; liquid elevators; part thereof","1.2368","1.3574","1.362","1.5009","1.3417","1.5723","1.3951","1.2955","1.3977","1.4626","1.5003","1.68","1.3011","1.564","1.801","1.6574","1.3584","1.188","1.4202","1.0344","1.1508","1.1989","1.2764","1.3243","1.3423"
"8414","Air or vacuum pumps, air or other gas compressors and fans; ventilating or recycling hoods incorporating a fan, whether or not fitted with filters; parts thereof","0.8691","0.9038","1.414","1.5958","1.4697","1.6284","1.3964","1.4666","1.6325","1.6976","1.2835","1.4675","1.62","1.3932","1.0297","0.9397","1.1047","1.0499","1.0946","0.9727","1.1187","1.3026","1.3602","1.0118","0.9928"
"8415","Air conditioning machines, comprising a motor-driven fan and elements for changing the temperature and humidity, including those machines in which the humidity cannot be separately regulated; parts thereof","0.5554","0.6914","0.801","0.7767","0.7894","0.9513","1.153","0.9774","0.9211","0.8365","0.6729","0.7947","0.6527","0.8801","0.5243","0.4884","0.2271","0.2552","0.3474","0.3421","0.2703","0.4352","0.4814","0.4541","0.2833"
"8416","Furnace burners for liquid fuel, for pulverized solid fuel or for gas; mechanical stokers, including their mechanical grates, mechanical ash dischargers and similar appliances; parts thereof","1.3732","1.1784","1.3449","1.2482","1.2872","0.9186","1.4326","1.3449","1.5641","1.6207","1.7521","1.5235","1.5438","1.1053","1.4864","1.7454","1.6677","1.7491","2.0073","1.8361","1.5177","1.9837","1.565","1.6978","1.9301"
"8417","Industrial or laboratory furnaces and ovens, including incinerators, nonelectric, and parts thereof","0.9821","0.837","1.1293","0.8335","0.9274","0.765","0.687","0.6664","0.7431","0.5682","1.0701","0.643","0.7933","0.5953","1.1503","1.067","1.005","1.1995","0.9917","0.8368","0.768","0.7614","1.1772","0.7872","0.9646"
"8418","Refrigerators, freezers and other refrigerating or freezing equipment, electric or other; heat pumps, other than the air conditioning machines of heading 8415; parts thereof","0.5903","0.7312","0.6042","0.6786","0.6475","0.5003","0.5196","0.4219","0.5003","0.2206","0.1787","0.3849","0.4434","0.4388","0.3269","0.2382","0.4003","0.0164","0.2985","0.1822","0.2998","0.2606","0.1832","0.3515","-0.0728"
"8419","Machinery, plant or laboratory equipment, whether or not electrically heated (excluding furnaces, ovens and other equipment of heading 8514), for the treatment of materials by a process involving a change of temperature such as heating, cooking, roasting,","1.1688","1.5173","1.4001","1.3587","1.5286","1.4825","1.5588","1.3587","1.6445","1.3978","1.6893","1.3744","1.4715","1.3123","1.5292","1.5032","1.2233","1.1362","1.2804","1.4168","1.2297","1.6999","1.0011","1.2593","1.659"
"8420","Calendering or other rolling machines, other than for metals or glass, and cylinders therefor; parts thereof","1.6074","1.4156","1.553","1.2607","0.8948","1.3044","1.1932","1.7672","1.6099","1.2414","1.3876","1.5858","1.0498","1.6657","1.2373","1.4056","2.0616","1.5613","1.2664","0.9284","1.4728","1.686","2.6546","2.1635","1.9775"
"8421","Centrifuges, including centrifugal dryers; filtering or purifying machinery and apparatus, for liquids or gases; parts thereof","1.0875","1.0605","1.0377","1.0294","1.3557","1.3169","1.0492","1.1702","1.0437","1.2255","1.5627","1.3725","1.3915","1.5255","1.7215","1.6811","1.4825","1.1994","1.6899","1.107","1.2874","1.5137","1.1809","1.661","1.5325"
"8422","Dishwashing machines; machinery for cleaning or drying bottles or other containers; machinery for filling, closing, sealing or labeling bottles, cans, boxes, bags or other containers; machinery for capsuling bottles, jars, tubes and similar containers; ot","1.1456","0.7734","1.2767","1.1866","0.954","1.4205","1.0039","1.183","1.1817","0.7814","0.6365","1.4104","1.2562","1.2635","1.5322","1.2835","1.0355","1.6823","1.5391","1.0777","1.4232","1.3529","0.9569","1.9293","1.4729"
"8423","Weighing machinery (excluding balances of a sensitivity of 5 cg or better), including weight-operated counting or checking machines; weighing machine weights of all kinds; parts of weighing machinery","0.5935","0.8755","0.6651","0.8281","0.8526","0.8632","0.8339","0.9215","0.4815","0.3043","0.6279","0.6944","0.7043","0.2934","0.5612","0.6373","0.6578","0.3301","0.2498","0.455","0.5159","0.3162","0.6293","0.7927","0.6194"
"8424","Mechanical appliances (whether or not hand operated) for projecting, dispersing or spraying liquids or powders; fire extinguishers, whether or not charged; spray guns and similar appliances; steam or sand blasting machines and similar jet projecting machi","0.973","1.2122","1.2069","1.4238","1.3525","1.2772","1.1194","1.3485","1.369","0.5567","1.0777","0.8734","1.1689","1.3857","1.5201","1.1358","1.0602","0.9012","1.1046","1.4719","1.1247","1.3323","1.6709","1.8102","1.8002"
"8425","Pulley tackle and hoists other than skip hoists; winches and capstans; jacks","0.773","0.5007","0.6091","0.4516","0.5593","0.6348","0.899","1.0732","0.809","0.7413","0.9704","0.8503","0.4544","0.1205","0.7102","0.6733","0.8772","0.6847","0.7168","0.6662","0.4345","0.5393","0.6819","0.8282","0.2853"
"8426","Ships' derricks; cranes, including cable cranes; mobile lifting frames, straddle carriers and works trucks fitted with a crane","0.1572","-0.0549","-0.0502","-0.1274","0.4904","0.2361","0.5157","0.3347","-0.16","0.1249","0.6602","0.5328","0.7315","0.8027","0.1263","0.2889","0.5662","0.4797","0.4844","0.5449","0.1355","0.098","0.9104","0.4306","0.7398"
"8427","Fork-lift trucks; other works trucks fitted with lifting or handling equipment","1.5902","1.5798","1.2863","1.1639","1.4477","1.0984","1.2367","1.5485","1.7976","1.9305","1.687","1.9792","1.4241","1.6301","1.1133","1.5133","1.5474","1.7616","1.7469","1.5764","1.1792","1.1617","1.7016","1.6462","1.4872"
"8428","Other lifting, handling, loading or unloading machinery (for example, elevators, escalators, conveyors, teleferics)","1.1197","1.1526","1.0154","1.0024","1.0412","1.3032","1.0073","1.0452","1.3722","1.1294","1.1539","1.4666","1.5029","1.7241","1.3361","1.8332","1.4154","1.1385","1.9506","1.7145","1.4035","2.0382","1.6355","2.082","1.5195"
"8429","Self-propelled bulldozers, angledozers, graders, levelers, scrapers, mechanical shovels, excavators, shovel loaders, tamping machines and road rollers","0.2463","0.6173","-0.0063","-0.0273","-0.0467","-0.1081","0.0626","-0.0343","0.1152","0.2235","-0.0255","0.2358","0.7497","0.7365","0.4851","0.4247","-0.2129","0.2921","0.4771","0.2248","0.1225","0.4593","1.0049","0.7709","0.3334"
"8430","Other moving, grading, leveling, scraping, excavating, tamping, compacting, extracting or boring machinery, for earth, minerals or ores; pile-drivers and pile-extractors; snowplows and snowblowers","-0.6685","-0.4789","-1.0767","-0.7131","-0.4094","-0.8495","-0.9827","-0.4372","-0.4818","-0.9258","-0.2305","-0.6775","-0.284","-0.0263","-0.0036","-0.2587","-0.3046","-0.6942","-0.4109","-0.5876","-0.1475","-0.4968","0.2305","-0.1597","0.2819"
"8431","Parts suitable for use solely or principally with the machinery of headings 8425 to 8430","0.7675","0.8647","0.7384","0.6705","0.755","0.339","0.6529","0.4133","0.7712","0.6213","0.4838","0.9134","1.0402","0.9314","0.6483","1.1005","1.3025","0.9358","0.6851","1.0077","0.3725","0.689","0.8909","1.148","1.2901"
"8432","Agricultural, horticultural or forestry machinery for soil preparation or cultivation; lawn or sports ground rollers; parts thereof","0.7983","0.7233","0.5957","0.4521","0.6831","0.5435","0.4472","0.4469","0.6422","0.6542","0.4018","0.7589","0.6217","0.8075","0.66","0.6354","0.5443","0.6488","0.6152","0.3881","0.5393","0.5196","0.7025","0.6526","0.4953"
"8433","Harvesting or threshing machinery, including straw or fodder balers; grass or hay mowers; machines for cleaning, sorting or grading eggs, fruit or other agricultural produce, other than machinery of heading 8437; parts thereof","0.8408","0.88","0.7336","0.9109","0.9366","0.8198","0.8489","0.9736","0.9016","0.93","1.0252","0.9067","1.1983","1.2675","1.0833","1.0859","1.264","1.0083","0.8891","0.7026","1.2038","1.0734","1.1437","1.1239","1.2182"
"8434","Milking machines and dairy machinery, and parts thereof","0.2298","0.6216","0.8685","0.5815","0.7028","0.9286","0.7201","0.7927","0.2868","0.4769","0.4198","1.0968","1.0128","1.2874","0.7633","0.926","0.9848","0.7791","0.3938","1.2237","0.8277","1.0125","1.0191","1.0556","0.8271"
"8435","Presses, crushers and similar machinery, used in the manufacture of wine, cider, fruit juices or similar beverages; parts thereof","0.1128","0.2392","0.5991","0.462","0.6098","0.0045","0.1028","0.1759","0.0004","0.0197","0.1783","0.6014","1.1374","0.4145","0.242","0.2401","0.4858","0.1318","0.1565","0.3757","0.5727","1.1815","1.105","0.6713","1.1419"
"8436","Other agricultural, horticultural, forestry, poultry-keeping or bee-keeping machinery, including germination plant fitted with mechanical or thermal equipment; poultry incubators and brooders; parts thereof","0.8986","1.0106","0.6404","0.7707","0.8658","0.896","0.8357","0.7256","0.9381","1.0356","1.1062","1.324","1.1045","1.0178","1.1258","1.2267","1.6594","1.3944","0.9377","0.904","1.3244","1.3454","1.2488","1.3341","1.4454"
"8437","Machines for cleaning, sorting or grading seed, grain or dried leguminous vegetables, and parts thereof; machinery used in the milling industry or for the working of cereals or dried leguminous vegetables, other than farm type machinery; parts thereof","-0.081","0.3831","0.079","0.5382","-0.0561","0.1148","-0.2481","-0.1119","-0.4789","-0.0892","0.2326","-0.2444","0.1781","-0.6445","0.1097","-0.143","-0.3821","-0.6403","-0.1899","-0.1852","0.1217","0.2409","-0.2048","0.3231","0.1372"
"8438","Machinery, not specified or included elsewhere in this chapter, for the industrial preparation or manufacture of food or drink, other than machinery for the extraction or preparation of animal or fixed vegetable fats or oils; parts thereof","0.6493","0.6094","0.4029","0.4236","0.6523","0.8197","0.2677","0.3899","-0.0135","0.3945","0.1639","0.5624","0.4036","0.7777","0.8797","0.5773","0.4636","0.3794","0.6183","0.6668","0.6273","0.7007","1.0896","1.0106","1.1427"
"8439","Machinery for making pulp of fibrous cellulosic material or for making or finishing paper or paperboard (other than the machinery of heading 8419); parts thereof","1.5904","1.8007","1.7204","1.5296","1.4722","1.7042","1.6228","1.2418","1.6235","1.5017","1.5877","1.4187","2.0451","1.5373","1.5138","1.265","1.7279","1.4024","1.8342","1.7503","0.8978","1.6201","0.9353","2.0349","1.4781"
"8440","Bookbinding machinery, including book-sewing machines, and parts thereof","1.348","1.1397","0.8217","1.4574","1.2308","0.6706","0.8534","1.0739","1.1488","1.5817","0.946","1.0026","1.3634","0.8924","1.1046","1.2132","1.5571","1.1866","1.7263","0.695","1.2845","1.3369","1.5587","1.8372","0.5246"
"8441","Other machinery for making up paper pulp, paper or paperboard, including cutting machines of all kinds, and parts thereof","1.1909","1.2467","0.6692","1.1047","0.9932","1.4825","1.4585","1.202","1.3461","0.7533","1.2964","1.542","1.5689","1.5976","1.1114","1.5502","1.587","1.1996","1.1102","1.9867","1.0814","1.738","1.2912","2.1502","1.7115"
"8442","Machinery, apparatus and equipment (other than the machine tools of headings 8456 to 8465), for preparing or making plates, cylinders or other printing components; plates, cylinders and other printing components; plates, cylinders and lithographic stones,","0.8895","1.0284","0.8919","0.8838","1.0119","1.0535","1.2061","1.54","1.2923","1.2549","0.5711","1.5597","1.0838","1.505","1.2689","1.571","1.5077","1.5545","1.6917","1.5462","1.5584","1.3772","1.1959","1.5378","1.4311"
"8443","Printing machinery used for printing by means of plates, cylinders and other printing components of heading 8442; other printers, copying machines and facsimile machines, whether or not combined; parts and accessories thereof","1.3806","1.4237","1.274","0.8087","1.2612","1.2766","1.2257","1.0478","0.9588","1.0111","1.0456","1.213","0.8818","2.037","1.8493","1.9515","1.7342","1.8247","1.4795","2.169","2.3399","1.9854","2.2181","1.861","1.9274"
"8444","Machines to extrude, draw, cut manmade textile fibres","2.2578","1.5128","1.6805","2.1087","1.4388","2.1225","1.7961","2.1922","1.9333","1.1459","1.2307","1.2922","1.2499","0.9435","1.1471","1.6533","2.2126","1.3239","1.2326","0.9847","1.009","1.7145","1.4421","1.1435","2.8067"
"8445","Machines for preparing textile fibers; spinning, doubling or twisting machines and other machinery for producing textile yarns; textile reeling or winding (including weft winding) machines and machines for preparing textile yarns for use on the machines o","1.0914","0.8889","1.1204","1.6378","1.3564","1.7205","0.7728","0.9967","0.4351","0.1633","0.4692","1.067","1.2757","0.3755","1.3315","0.3653","1.0614","0.9239","0.8487","1.4001","1.2593","2.1343","1.9413","0.8404","0.7955"
"8446","Weaving machines (looms)","0.7249","0.535","1.1268","0.7091","0.4905","0.9485","0.0945","0.7989","1.2779","0.4704","0.3442","0.6416","1.4879","0.7956","0.5836","0.7995","1.388","1.0629","0.6258","0.9826","1.3788","2.0659","2.3314","1.9047","1.2629"
"8447","Knitting machines, stitch-bonding machines and machines for making gimped yarn, tulle, lace, embroidery, trimmings, braid or net and machines for tufting","0.8649","0.845","0.6703","0.54","0.6092","0.8856","0.8409","0.3724","1.1306","1.2245","0.269","0.4021","0.7097","0.7986","-0.1213","0.402","1.891","0.5267","0.8744","1.0528","1.1363","0.5647","1.3445","1.2095","1.9722"
"8448","Auxiliary machinery for use with machines of heading 8444, 8445, 8446 or 8447 (for example, dobbies, Jacquards, automatic stop motions and shuttle changing mechanisms); parts and accessories suitable for use solely or principally with the machines of this","1.629","1.6189","1.4363","1.3621","1.2276","1.2158","1.2648","1.1009","0.862","1.165","0.9941","1.1296","1.1672","0.901","1.1154","0.9145","0.8365","1.2845","0.8606","1.346","1.0142","0.8989","1.4184","1.5478","0.9985"
"8449","Machinery for the manufacture or finishing of felt or nonwovens in the piece or in shapes, including machinery for making felt hats; blocks for making hats; parts thereof:","1.3972","1.3643","0.9896","0.5712","1.4538","1.2437","1.0178","1.1653","1.709","1.4952","0.9981","0.8951","1.5341","1.3507","1.3967","1.4994","1.1038","1.2337","1.5371","1.2447","0.7236","1.3662","0.7435","1.0564","1.6064"
"8450","Household- or laundry-type washing machines, including machines which both wash and dry; parts thereof","0.4684","0.2657","0.5286","0.4712","0.5808","0.5132","0.7376","0.6928","0.8911","0.7897","1.1811","0.7585","0.8852","0.992","0.8048","0.6281","0.4892","0.4527","0.4927","0.5369","0.7755","0.6021","0.6788","0.5743","0.5293"
"8451","Machinery (other than machines of heading 8450) for washing, cleaning, wringing, drying, ironing, pressing (including fusing presses), bleaching, dyeing, dressing, finishing, coating or impregnating textile yarns, fabrics or made up textile articles and m","1.3371","1.2607","1.223","1.1209","0.8313","1.2873","1.168","1.2522","1.2721","1.039","1.3385","0.9702","0.5505","0.7324","0.7412","0.8791","1.0873","0.5948","0.3869","0.5653","0.6891","0.9919","0.8852","0.2689","1.0376"
"8452","Sewing machines, other than book-sewing machines of heading 8440; furniture, bases and covers specially designed for sewing machines; sewing machine needles; parts thereof","0.2427","0.4446","0.1909","0.4385","0.7991","0.4227","0.4289","0.7362","0.8157","-0.455","-0.2399","-0.2754","0.0262","-0.0944","-0.4618","0.0473","0.3728","-0.3705","0.013","0.3943","0.6459","0.5627","0.2513","0.3391","0.5698"
"8453","Machinery for preparing, tanning or working hides, skins or leather or for making or repairing footwear or other articles of hides, skins or leather, other than sewing machines; parts thereof","0.5478","0.5762","0.6154","0.4967","0.2276","0.1766","-0.0272","-0.1322","-0.2084","-0.0339","-0.2197","0.0612","0.1148","-0.1728","0.0391","-0.4878","-0.352","-0.5306","-0.2219","-0.1326","-0.8597","-0.3036","0.1149","-0.2851","0.4905"
"8454","Converters, ladles, ingot molds and casting machines, of a kind used in metallurgy or in metal foundries, and parts thereof","1.2362","1.2629","1.4126","1.8037","1.2576","1.0781","0.7684","0.9854","1.217","0.7889","1.4087","0.7151","1.3506","1.1768","0.8522","0.6761","0.6706","0.8761","0.8931","1.1587","0.9876","1.0546","0.8596","1.1393","1.4958"
"8455","Metal-rolling mills and rolls therefor; parts thereof","1.1873","1.005","1.5327","0.9838","1.365","1.0671","0.9295","1.05","0.8056","0.9293","0.7954","1.2461","0.7259","0.9907","0.8335","0.6883","0.7151","1.0587","0.9759","0.8294","1.1315","1.2981","1.0739","1.5845","1.449"
"8456","Machine tools for working any material by removal of material, by laser or other light or photon beam, ultrasonic, electro-discharge, electro-chemical, electron-beam, ionic-beam or plasma arc processes","1.8537","1.5495","1.8653","2.8906","2.9255","2.0408","2.094","1.7153","2.1918","1.8366","1.6454","2.177","2.3663","2.0282","1.9301","2.2534","1.9822","1.5984","2.067","1.3208","2.1302","1.8999","2.0147","1.8517","1.3498"
"8457","Machining centers, unit construction machines (single station) and multistation transfer machines, for working metal","2.2328","2.5669","1.6483","2.3144","2.3204","2.3512","2.3829","2.3953","1.7646","2.2584","2.1988","1.8199","1.9542","2.0272","1.1972","1.5932","1.6684","1.229","2.2653","1.6278","1.7714","1.7952","1.742","1.5222","2.0969"
"8458","Lathes (including turning centers) for removing metal","1.9002","1.8893","2.129","1.9805","1.9578","1.8717","1.8079","1.3971","1.2585","1.5432","1.4694","1.7079","1.5185","1.749","1.165","1.1379","0.9023","1.0006","0.9174","0.8053","0.7415","0.8772","0.7267","0.8782","1.2217"
