"HS 1992 Code","Product","PCI 2019","PCI 2018","PCI 2017","PCI 2016","PCI 2015","PCI 2014","PCI 2013","PCI 2012","PCI 2011","PCI 2010","PCI 2009","PCI 2008","PCI 2007","PCI 2006","PCI 2005","PCI 2004","PCI 2003","PCI 2002","PCI 2001","PCI 2000","PCI 1999","PCI 1998","PCI 1997","PCI 1996","PCI 1995"
"0101","Live horses, asses, mules or hinnies","0.2359","-0.1434","0.3298","-0.1737","-0.2747","-0.3154","0.1177","-0.4661","0.2735","0.095","-0.3455","-0.0886","-0.1086","-0.0281","-0.2723","0.2439","0.2536","0.1171","0.0329","0.1284","-0.0488","0.078","0.0344","-0.0472","0.0367"
"0102","Live bovine animals","-0.464","-0.4094","-0.7408","-0.7747","-0.8479","-0.9091","-0.838","-0.8613","-0.879","-0.7592","-0.5682","-0.6548","-0.6386","-0.6862","-0.8279","-0.9048","-0.952","-1.1785","-1.2963","-0.6502","-0.6309","-0.4732","-0.6425","-0.8897","-0.4485"
"0103","Live swine","0.658","0.6416","0.6824","0.5167","0.6984","0.7783","0.7556","0.7542","0.7767","0.5638","0.9601","1.1014","0.9085","0.8832","0.4447","0.4954","0.1922","0.3474","0.231","0.0773","0.1178","0.1633","0.1127","0.5797","0.2191"
"0104","Live sheep and goats","-1.4681","-1.4941","-1.6325","-1.5967","-1.8933","-1.7824","-1.7758","-1.7333","-1.6765","-1.4903","-1.4385","-1.6908","-1.4806","-1.4516","-1.694","-1.62","-1.6872","-1.6085","-1.2345","-1.2245","-1.1938","-1.1951","-0.9743","-1.605","-0.9384"
"0105","Live poultry of the following kinds Chickens, ducks, geese, turkeys and guineas","-0.0405","0.0094","-0.1188","0.0871","-0.0787","-0.0701","0.0519","0.1397","-0.1274","0.0148","0.1693","0.1897","-0.0394","0.1208","-0.3021","-0.5939","-0.4689","-0.3252","-0.4778","-0.0166","0.0697","0.1224","0.1423","-0.0064","-0.1163"
"0106","Other live animals","-1.2249","-1.503","-1.2576","-1.3659","-1.653","-1.4416","-1.3997","-1.7288","-1.7532","-1.5602","-1.5306","-1.5214","-1.6211","-1.7128","-1.7104","-1.7379","-1.6389","-1.7749","-1.955","-1.6226","-1.7833","-1.7583","-1.6301","-1.9092","-1.8181"
"0201","Meat of bovine animals, fresh or chilled","-0.5226","-0.6344","-0.5546","-0.4982","-0.1809","-0.3835","-0.2717","-0.1757","-0.2399","-0.0848","-0.1224","-0.147","-0.438","-0.2686","-0.3046","-0.0176","-0.19","0.0211","-0.1549","-0.3942","-0.0432","-0.3003","-0.2586","-0.3121","-0.298"
"0202","Meat of bovine animals, frozen","-0.8561","-1.1634","-1.2269","-1.0377","-0.9678","-1.0976","-1.0236","-0.9847","-1.544","-0.7898","-0.831","-1.1668","-0.8901","-1.328","-1.2862","-1.0713","-0.6981","-1.1001","-1.0072","-0.7081","-0.9008","-0.8454","-1.0189","-1.2519","-0.8999"
"0203","Meat of swine, fresh, chilled or frozen","0.8584","0.9732","0.9705","0.9075","0.8364","0.5839","0.9765","1.0046","1.0363","1.0165","1.0816","1.174","1.1463","0.7933","1.0426","0.723","0.8655","0.7888","0.6179","0.7399","0.7146","0.3829","0.48","0.7524","0.9237"
"0204","Meat of sheep or goats, fresh, chilled or frozen","-1.5756","-1.7054","-1.7126","-1.3748","-1.2194","-1.6557","-1.4767","-1.6492","-1.6472","-1.6735","-1.3081","-0.9942","-1.2062","-1.2921","-1.04","-0.7977","-0.7505","-0.9925","-0.9895","-1.1557","-0.9314","-1.2124","-0.7228","-1.2006","-0.7291"
"0205","Meat of horses, asses, mules or hinnies, fresh, chilled or frozen","-0.7857","-0.4506","-0.7066","-0.7193","-0.2295","-0.2339","-0.2085","0.1007","-0.0735","0.0432","-0.1674","-0.331","-0.4115","-0.3225","-0.085","-0.0701","-0.2185","0.0363","0.1046","0.3558","-0.5347","-0.6044","-0.3238","-0.3044","0.01"
"0206","Edible offal of bovine animals, swine, sheep, goats, horses, asses, mules or hinnies, fresh, chilled or frozen","-0.229","-0.5528","-0.4834","-0.611","-0.3305","-0.4184","-0.5323","-0.5015","-0.3342","-0.4475","-0.1558","-0.0413","-0.383","-0.5672","-0.5765","-0.5001","-0.1818","-0.3696","-0.2776","-0.3145","-0.5654","-0.3476","-0.3979","-0.2941","-0.1451"
"0207","Meat and edible offal, of the poultry of heading 0105, fresh, chilled or frozen","0.0303","0.0239","-0.0333","0.1974","0.2215","0.1221","0.3191","0.31","0.4454","0.2747","0.2543","0.2883","0.3726","0.4102","0.369","0.3343","0.3243","-0.075","0.5245","0.1622","0.1162","-0.0388","0.037","0.1376","0.0523"
"0208","Other meat and edible meat offal, fresh, chilled or frozen","-0.3657","-0.2728","-0.1644","-0.0983","-0.2434","-0.0327","-0.1159","-0.2357","-0.2676","-0.8128","-0.5506","-0.2119","-0.2308","-0.282","-0.4027","-0.305","-0.2427","-0.2889","-0.2656","-0.2482","-0.1088","-0.2222","-0.399","-0.1249","-0.198"
"0209","Pig fat, free of lean meat, and poultry fat, not rendered or otherwise extracted, fresh, chilled, frozen, salted, in brine, dried or smoked","0.5361","0.3613","0.507","0.2652","0.1925","0.1784","0.7568","0.8297","0.9216","0.9869","1.0144","0.8859","0.953","0.5943","0.7505","0.8561","0.6411","0.933","0.9063","0.688","0.6383","0.7116","0.4704","0.631","0.5697"
"0210","Meat and edible meat offal, salted, in brine, dried or smoked; edible flours and meals of meat or meat offal","0.0553","0.2298","0.1579","0.4869","0.4956","0.4246","0.1151","-0.0942","-0.1252","0.0197","0.3558","0.5023","0.2693","0.1166","0.0844","0.5925","-0.0513","0.9792","0.9385","0.3709","0.5728","0.7878","0.5379","0.8362","0.6535"
"0301","Live fish","-1.1477","-1.3454","-1.2256","-0.9282","-1.1859","-1.0688","-1.0923","-1.2751","-0.9759","-1.1353","-1.4328","-1.1947","-1.3147","-1.244","-1.3006","-1.1982","-1.3798","-1.3393","-1.4485","-1.5645","-1.7454","-1.7849","-1.4939","-1.7012","-1.694"
"0302","Fish, fresh or chilled, excluding fish fillets and other fish meat of heading 0304","-1.4513","-1.2824","-1.3522","-1.2503","-1.3461","-1.3926","-1.2813","-1.3855","-1.3488","-1.5035","-1.439","-1.5973","-1.7088","-1.3382","-1.4625","-1.5482","-1.5321","-1.6975","-1.5253","-1.7273","-1.6022","-1.7479","-1.7784","-1.5504","-1.645"
"0303","Fish, frozen, excluding fish fillets and other fish meat of heading 0304","-1.7656","-1.6579","-1.8541","-1.4009","-1.3524","-1.6","-1.4322","-1.2953","-1.3547","-1.3905","-1.5018","-1.5444","-1.5793","-1.4983","-1.5916","-1.5622","-1.4778","-1.5362","-1.6297","-1.763","-1.7491","-1.9619","-1.8103","-1.6763","-2.0093"
"0304","Fish fillets and other fish meat (whether or not minced), fresh, chilled or frozen","-1.3838","-1.294","-1.4784","-1.2516","-1.0815","-1.1132","-1.3021","-1.322","-1.1289","-1.2395","-1.4855","-1.5198","-1.4697","-1.3849","-1.4752","-1.3276","-1.3103","-1.3879","-1.5794","-1.4456","-1.3199","-1.443","-1.5102","-1.4623","-1.5506"
"0305","Fish, dried, salted or in brine; smoked fish, whether or not cooked before or during the smoking process; flours, meals and pellets of fish, fit for human consumption","-1.5586","-1.5815","-1.457","-1.5093","-1.6307","-1.6717","-1.5878","-1.6303","-1.6507","-1.6104","-1.5404","-1.4617","-1.7257","-1.6394","-1.7489","-1.884","-1.8166","-1.8976","-1.899","-2.1141","-1.9249","-2.0239","-2.0619","-2.1928","-2.1551"
"0306","Crustaceans, whether in shell or not, live, fresh, chilled, frozen, dried, salted or in brine; crustaceans, in shell, cooked by steaming or by boiling in water, whether or not chilled, frozen, dried, salted or in brine; flours, meals and pellets of crusta","-1.8317","-1.8491","-1.9614","-1.7322","-1.8536","-1.7866","-1.6186","-1.6734","-1.6347","-1.7623","-1.5021","-1.6594","-1.6486","-1.8138","-1.9486","-1.8706","-1.7697","-1.8042","-1.9629","-1.9159","-1.9981","-2.0555","-2.3436","-2.2024","-2.2762"
"0307","Molluscs, whether in shell or not, live, fresh, chilled, frozen, dried, salted or in brine; aquatic invertebrates other than crustaceans and molluscs, live, fresh, chilled, frozen, dried, salted or in brine; flours, meals and pellets of aquatic invertebra","-1.8136","-1.6717","-1.6934","-1.6866","-1.7086","-1.5088","-1.5458","-1.6745","-1.6706","-1.7866","-1.6629","-1.6431","-1.7373","-1.7663","-1.9396","-1.8334","-1.9286","-2.0143","-1.7063","-2.032","-1.9336","-2.0831","-2.1889","-2.122","-2.1963"
"0401","Milk and cream, not concentrated nor containing added sugar or other sweetening matter","-0.0583","-0.0251","-0.002","-0.1661","-0.2872","-0.1495","-0.0875","-0.1211","0.0174","0.0607","0.0732","0.0801","0.1662","0.1662","-0.0134","0.1664","0.2557","0.5452","0.7292","0.2463","0.4843","0.3228","0.3907","0.4017","0.3562"
"0402","Milk and cream, concentrated or containing added sugar or other sweetening matter","-0.7277","-0.8388","-0.8341","-0.7934","-0.6755","-0.8129","-0.8547","-0.7451","-0.7094","-0.802","-1.129","-0.7427","-0.7595","-0.9363","-0.6364","-0.7927","-0.858","-0.5271","-0.714","-0.5131","-0.4735","-0.2118","-0.0837","-0.4363","0.0668"
"0403","Buttermilk, curdled milk and cream, yogurt, kephir and other fermented or acidified milk and cream, whether or not concentrated or containing added sugar or other sweetening matter or flavored or containing added fruit, nuts or cocoa","-0.2317","-0.1485","-0.0046","0.1527","-0.0536","-0.0499","-0.0454","0.0928","-0.1354","0.1792","0.1282","0.3528","0.231","0.216","0.3649","0.2912","0.2304","0.1223","0.1506","0.2026","0.4369","0.1131","-0.0563","0.0262","-0.0486"
"0404","Whey, whether or not concentrated or containing added sugar or other sweetening matter; products consisting of natural milk constituents, whether or not containing added sugar or other sweetening matter, not elsewhere specified or included","0.842","0.4904","0.4722","0.2769","0.3525","0.3401","0.387","0.5297","0.5388","0.7769","0.8801","0.5777","0.8932","0.6433","0.7082","0.7174","0.8077","0.5233","1.0176","0.7485","0.9533","1.1607","0.8413","1.1517","0.8208"
"0405","Butter and other fats and oils derived from milk; dairy spreads","0.0777","-0.0097","0.2044","-0.1207","-0.3357","-0.1333","-0.0448","0.0033","-0.0371","-0.2931","-0.017","-0.3435","-0.1744","-0.0246","-0.2154","0.1533","0.1541","0.1884","0.3508","0.1578","0.636","0.3396","0.3883","0.3728","0.4067"
"0406","Cheese and curd","-0.0557","-0.0316","-0.1341","-0.1629","-0.0994","-0.0726","-0.1771","-0.0725","-0.013","0.131","0.0994","0.0667","0.1825","0.1297","0.2461","0.3004","0.3294","0.3314","0.3952","0.2744","0.1973","0.3882","0.2932","0.4071","0.3252"
"0407","Birds eggs, in shell, fresh, preserved or cooked","-0.5146","-0.6227","-0.4669","-0.7102","-0.5639","-0.3212","-0.143","-0.2533","-0.4227","-0.5278","-0.2209","-0.5679","-0.3601","-0.2126","-0.4661","-0.4888","-0.5711","-0.8363","-0.773","-0.7177","-0.6244","-0.7668","-0.3456","-0.409","-0.5364"
"0408","Birds' eggs, not in shell, and egg yolks, fresh, dried, cooked by steaming or by boiling in water, molded, frozen or otherwise preserved, whether or not containing added sugar or other sweetening matter","0.1001","0.4378","0.6444","0.1978","0.1147","0.1613","0.1736","0.5291","0.6669","0.5403","0.3911","0.0227","0.2129","-0.1628","0.1571","-0.11","-0.3255","0.1544","0.0527","-0.0855","-0.0859","0.2679","0.3821","0.3657","0.5978"
"0409","Amber or darker","-1.1639","-1.0181","-0.945","-0.8231","-0.9205","-0.911","-0.7907","-0.9891","-0.9564","-1.0037","-1.0043","-1.1637","-0.8865","-0.8243","-0.8164","-0.9091","-0.8997","-0.8798","-0.9118","-1.2788","-1.1334","-1.0428","-1.2351","-1.0271","-1.0556"
"0410","Edible products of animal origin, not elsewhere specified or included","-0.5184","-0.3867","-0.5438","-0.2567","-0.447","-0.4593","-0.4968","0.0973","-0.5969","-1.1295","-0.3369","-0.4382","-0.4224","-0.3617","-0.7254","-0.6609","-0.6371","-0.8483","-0.3104","-0.6419","-0.6612","-0.7846","-1.429","-1.2301","-1.2697"
"0501","Human hair, unworked, whether or not washed or scoured; waste of human hair","-1.4282","-1.1123","-1.7611","-1.4954","-1.8402","-2.1862","-2.3502","-1.595","-2.2075","-1.0859","-1.0833","-1.5161","-0.0899","-1.1365","-0.649","-0.9724","-0.7899","-0.5773","-0.5243","-0.4741","-0.869","-1.04","-1.1565","-1.0387","-0.7604"
"0502","Pigs', hogs' or boars' bristles and hair; badger hair and other brushmaking hair; waste of such bristles or hair","-0.8634","-0.961","-0.2693","0.1384","-0.65","0.013","-0.2237","-0.6324","-1.2443","-0.7887","-1.0305","-1.3992","-0.8627","-0.3718","-0.2581","0.1547","-0.9554","-0.1391","-1.0514","-0.3223","-1.1481","-1.3165","-0.8423","-0.7552","-0.8741"
"0503","Horsehair and horsehair waste, whether or not put up as alayer with or without supporting material","","","","3.0832","3.1637","","","-7.4578","","","-0.4452","-0.3835","-1.2049","-0.7157","-0.8124","-0.5727","-0.388","-0.2436","-0.9881","-0.5558","-0.1877","-0.1206","0.1987","-0.348","-0.6367"
"0504","Guts, bladders and stomachs of animals except fish","-1.076","-1.1611","-0.9996","-1.0064","-0.9295","-1.0971","-1.0587","-0.9155","-0.8738","-1.0971","-0.9905","-0.8751","-0.8197","-0.9172","-0.9142","-0.7899","-0.9019","-1.1295","-1.0318","-0.8128","-0.9337","-0.9931","-0.7424","-0.7954","-0.7562"
"0505","Skins and other parts of birds, with their feathers or down, feathers and parts of feathers(whether or not with trimmed edges) and down, not further worked than cleaned, disinfected or treated for preservation; powder and waste of feathers or parts of fea","0.1921","0.5669","0.5647","0.6148","0.5857","0.6248","0.2918","0.4189","0.4739","0.5765","0.1298","0.6546","0.0417","0.0434","-0.3503","0.1258","-0.3432","-0.1799","-0.254","-0.2825","-0.4122","-0.6085","-0.5403","-0.4832","-0.5666"
"0506","Bones and horn-cores, unworked, defatted, simply prepared (but not cut to shape), treated with acid or degelatinized; powder and waste of these products","-0.4868","-0.47","-0.4706","-0.4657","-0.5902","-0.5535","-0.423","-0.9937","-0.6257","-0.7458","-0.8714","-0.6885","-1.034","-1.0471","-0.8467","-0.8316","-1.0006","-1.2086","-1.6173","-1.6792","-1.633","-1.6366","-1.7945","-1.4119","-1.5991"
"0507","Ivory, tortoise-shell, whalebone and whalebone hair, horns, antlers, hooves, nails, claws and beaks, unworked or simply prepared but not cut to shape; powder and waste of these products","-1.3114","-1.4318","-1.3393","-1.9001","-1.5549","-1.7802","-1.7726","-1.8097","-1.6113","-1.8604","-2.0012","-2.1548","-2.0169","-1.8501","-1.9739","-2.0845","-2.1375","-1.8245","-2.0113","-2.0865","-1.9488","-1.943","-1.8467","-1.8935","-2.0479"
"0508","Coral and similar materials, unworked or simply prepared but not otherwise worked; shells of molluscs, crustaceans or echinoderms and cuttlebone, unworked or simply prepared but not cut to shape, powder and waste thereof","-1.3701","-0.9206","-1.4119","-1.4484","-1.6995","-1.6248","-1.6527","-1.7502","-1.6719","-1.7143","-1.7758","-1.6087","-1.8138","-1.7106","-1.4738","-1.3234","-1.5517","-1.4658","-1.2932","-1.5396","-1.7369","-1.8284","-1.7297","-1.7664","-1.995"
"0509","Sponges, natural, of animal origin","","","","-0.5008","-0.4931","0.1356","0.3707","-1.5488","0.2922","0.2213","-0.0603","-0.0305","-1.5785","-0.4571","-0.8418","-0.6931","-0.5623","-0.7882","-1.0323","-0.6874","-0.6844","-0.7965","-0.9783","-0.6018","-0.9795"
"0510","Ambergris, castoreum, civet and musk; cantharides; bile, whether or not dried; glands and other animal products used in the preparation of pharmaceutical products, fresh, chilled, frozen or otherwise provisionally preserved:","-2.2033","-1.7111","-1.4658","-1.7751","-1.3654","-1.2524","-1.2454","-1.1046","-0.9597","-0.6134","-1.0358","-1.0921","-0.8441","-1.4391","-1.4658","-1.3876","-0.9916","-0.8085","-0.676","-0.9971","-1.6442","-1.203","-1.2114","-1.4127","-1.069"
"0511","Animal products not elsewhere specified or included; dead animals of chapter 1 or 3, unfit for human consumption","-0.7916","-0.9274","-0.8592","-1.0474","-0.8585","-0.6563","-0.607","-0.4077","-0.757","-0.7005","-1.0454","-0.9787","-1.204","-1.0938","-1.2141","-0.9222","-1.0304","-1.1619","-1.0722","-1.2546","-0.7411","-0.9067","-1.0372","-1.224","-1.0735"
"0601","Bulbs, tubers, tuberous roots, corms, crowns and rhizomes, dormant, in growth or in flower; chicory plants and roots other than roots of heading 1212","-0.5456","-0.8204","-0.6725","-0.5719","-1.2084","-1.1728","-0.8678","-0.4802","-0.6184","-0.763","-0.9965","-1.0764","-1.5795","-0.7241","-0.8075","-0.9669","-0.5087","-0.498","-0.3076","-0.6331","-0.1523","-0.4806","0.249","-0.5083","-0.2407"
"0602","Other live plants (including their roots), cuttings and slips; mushroom spawn","-0.968","-0.8041","-1.0132","-1.1499","-0.6063","-1.0047","-0.9286","-0.5569","-0.899","-0.9639","-0.6467","-0.8013","-0.9473","-0.9346","-1.1772","-1.2017","-1.0654","-1.244","-1.1817","-1.0265","-1.3472","-1.2969","-1.1347","-1.2393","-1.0465"
"0603","Cut flowers and flower buds of a kind suitable for bouquets or for ornamental purposes, fresh, dried, dyed, bleached, impregnated or otherwise prepared","-1.7266","-1.4104","-1.5383","-1.2089","-1.5407","-1.5607","-1.5197","-1.2011","-1.2623","-1.4185","-1.9501","-1.6408","-1.4168","-1.4453","-1.5791","-1.9501","-1.8151","-1.6216","-1.9737","-1.7658","-1.7846","-1.6574","-1.7596","-1.892","-1.5572"
"0604","Foliage, branches and other parts of plants, without flowers or flower buds, and grasses, mosses and lichens, being goods of a kind suitable for bouquets or for ornamental purposes, fresh, dried, dyed, bleached, impregnated or otherwise prepared","-0.8834","-0.9615","-1.0071","-0.9924","-1.1086","-1.1497","-1.1657","-1.1892","-1.1646","-1.2945","-1.2941","-1.4644","-1.4492","-1.1312","-1.3273","-1.2152","-1.4118","-1.4199","-1.3812","-1.313","-1.3989","-1.2298","-1.1031","-1.2628","-1.0183"
"0701","Potatoes, fresh or chilled","-0.3576","-0.6059","-0.764","-0.7203","-1.0921","-1.0864","-0.8451","-0.8121","-0.8746","-0.6892","-0.5881","-0.6201","-0.8894","-0.7324","-0.7411","-1.0573","-0.7332","-0.7225","-0.3886","-0.7836","-0.4269","-0.6394","-0.4972","-0.3677","-0.4431"
"0702","Tomatoes, fresh or chilled","-1.208","-1.4556","-1.4709","-1.716","-1.1705","-1.1654","-0.9557","-0.9081","-1.2235","-0.9843","-1.0691","-1.1559","-0.9586","-1.0679","-0.8279","-1.0236","-1.1143","-0.8926","-0.9539","-0.7631","-0.8977","-1.0148","-0.8648","-0.9327","-0.519"
"0703","Onions, shallots, garlic, leeks and other alliaceous vegetables, fresh or chilled","-1.8875","-1.6636","-2.0211","-1.9549","-1.9872","-1.8365","-1.9388","-1.9218","-1.6855","-1.777","-1.7994","-1.759","-1.6268","-1.5907","-1.5543","-1.6188","-1.3388","-1.6045","-1.5725","-1.5516","-1.4821","-1.5731","-1.3859","-1.2274","-1.3869"
"0704","Cabbages, cauliflower, kohlrabi, kale and similar edible brassicas, fresh or chilled","-1.098","-1.1039","-1.3981","-1.3168","-0.8167","-0.9095","-0.8695","-0.7559","-0.9261","-0.9336","-0.9325","-1.0966","-1.0907","-1.1754","-1.1482","-0.8608","-0.8125","-0.8794","-0.9417","-0.9342","-0.9776","-0.7745","-0.7441","-0.6592","-0.3692"
"0705","Lettuce (Lactuca sativa) and chicory (Cichorium spp.), fresh or chilled","-0.6374","-1.0057","-0.9956","-1.1231","-0.1631","-0.4059","-0.157","-0.287","-0.1913","-0.1687","-0.2933","-0.0315","-0.4318","-0.2355","-0.0735","-0.1402","-0.1123","-0.3517","-0.1804","-0.6664","-0.2608","-0.4469","0.7459","0.3117","-0.0319"
"0706","Carrots, turnips, salad beets (salad beetroot), salsify, celeriac, radishes and similar edible roots, fresh or chilled","-0.5475","-0.7872","-1.0064","-0.9009","-0.8178","-0.6993","-0.6838","-0.718","-0.8568","-0.7427","-0.7144","-0.4106","-0.4692","-0.6238","-0.6406","-0.628","-0.4284","-0.4776","-0.3704","-0.5882","-0.4913","-0.6104","-0.6886","-0.387","-0.2296"
"0707","Cucumbers, including gherkins, fresh or chilled","-1.1167","-1.0226","-1.1861","-1.1791","-0.9361","-0.9432","-0.9199","-0.815","-1.0797","-0.8608","-0.8039","-0.8703","-0.8907","-1.0979","-0.8133","-0.8351","-0.8209","-0.8865","-0.9975","-0.8382","-0.7971","-0.6299","-0.4762","-0.4042","-0.5708"
"0708","Leguminous vegetables, shelled or unshelled, fresh or chilled","-2.0886","-1.8747","-1.933","-1.8769","-1.8917","-1.7407","-1.7142","-1.8922","-2.0476","-1.8519","-1.6526","-2.288","-1.8146","-1.7847","-2.0012","-1.9226","-1.968","-2.1476","-2.1022","-2.0113","-2.2364","-2.2538","-2.3024","-2.0734","-1.7263"
"0709","Other vegetables, fresh or chilled","-1.2612","-1.2857","-1.3692","-1.6237","-1.2543","-1.4011","-1.3351","-0.9953","-1.4237","-1.3633","-1.2253","-1.3343","-1.1894","-1.1916","-1.1593","-1.2462","-1.2135","-1.3264","-1.2082","-1.3058","-1.4186","-1.4382","-1.3546","-1.2725","-1.1899"
"0710","Vegetables (uncooked or cooked by steaming or boiling in water), frozen","-0.5421","-0.7166","-0.5031","-0.6934","-0.6894","-1.0091","-0.7668","-0.8158","-1.0202","-0.8762","-0.8318","-1.0448","-1.1626","-1.0631","-0.9335","-1.141","-1.015","-1.066","-0.9811","-1.0992","-0.9603","-1.0674","-1.0433","-1.0325","-1.0359"
"0711","Vegetables provisionally preserved (for example, by sulfur dioxide gas, in brine, in sulfur water or in other preservative solutions), but unsuitable in that state for immediate consumption","-1.3996","-1.1338","-1.3091","-1.3555","-1.047","-1.0935","-1.2616","-1.1675","-1.2095","-1.2134","-1.1255","-1.3071","-1.0375","-1.371","-1.2496","-1.1022","-0.9114","-1.1957","-1.2682","-1.463","-1.2654","-1.5274","-1.664","-1.2261","-1.2786"
"0712","Dried vegetables, whole, cut, sliced, broken or in powder, but not further prepared","-1.1137","-1.0484","-1.3432","-1.5813","-1.5487","-1.6159","-1.6342","-1.0014","-1.2644","-1.5075","-1.3246","-1.0812","-1.1416","-1.0515","-1.2375","-1.1145","-1.2181","-1.1447","-0.9755","-1.2633","-1.2073","-1.3085","-1.24","-0.965","-0.9501"
"0713","Dried leguminous vegetables, shelled, whether or not skinned or split","-1.9896","-1.7993","-1.9051","-2.0036","-1.9778","-2.0016","-2.0816","-1.9741","-2.2157","-2.0206","-1.877","-1.8243","-1.8741","-1.9757","-1.9383","-1.789","-1.757","-1.9085","-2.1358","-1.9406","-1.6289","-1.7387","-1.7298","-1.625","-1.554"
"0714","Cassava (manioc), arrowroot, salep, Jerusalem artichokes, sweet potatoes and similar roots and tubers with high starch or inulin content, fresh, chilled, frozen or dried, whether or not sliced or in the form of pellets; sago pith","-2.0288","-1.715","-2.032","-2.0713","-2.3717","-2.2527","-2.2333","-2.0088","-2.0074","-2.1452","-2.1631","-1.8713","-2.0289","-2.0369","-2.0685","-2.0549","-1.8616","-2.0537","-2.1051","-2.1353","-2.0539","-2.159","-2.3948","-2.1228","-2.0844"
"0801","Coconuts, Brazil nuts and cashew nuts, fresh or dried, whether or not shelled or peeled","-2.153","-2.1084","-2.4491","-2.3043","-2.2444","-2.2487","-2.3321","-2.2306","-2.2673","-2.2069","-2.4564","-2.2217","-2.209","-2.5524","-2.5744","-2.6156","-2.3192","-2.4111","-2.0729","-2.5237","-2.4019","-2.4509","-2.4716","-2.4009","-2.534"
"0802","Other nuts, fresh or dried, whether or not shelled or peeled","-1.6463","-1.7043","-1.7113","-1.5424","-1.5938","-1.6436","-1.8388","-1.7889","-1.7829","-1.6803","-1.3754","-1.6831","-1.4833","-1.3989","-1.3512","-1.3009","-1.2967","-1.4016","-1.3775","-1.154","-1.3659","-1.6053","-1.4815","-1.4839","-1.5445"
"0803","Bananas and plantains, fresh or dried","-1.9332","-1.874","-1.8417","-1.8653","-1.8784","-1.8077","-2.0278","-1.9889","-1.8876","-2.1391","-2.127","-2.0503","-1.843","-1.9999","-1.6291","-1.9656","-1.9085","-1.8827","-1.6009","-1.8128","-2.0975","-1.9016","-1.7099","-1.9224","-1.6807"
"0804","Dates, figs, pineapples, avocados, guavas, mangoes and mangosteens, fresh or dried","-1.8639","-1.8273","-1.7955","-1.8676","-1.8309","-1.8402","-1.8327","-1.786","-1.7123","-1.7425","-1.7013","-1.7521","-1.798","-1.8791","-1.818","-1.8129","-1.7665","-1.6996","-1.8526","-1.8345","-1.8592","-1.9263","-1.8229","-2.0046","-1.9703"
"0805","Citrus fruit, fresh or dried","-1.1674","-1.3314","-1.4589","-1.3419","-1.2714","-1.0629","-1.0553","-1.0908","-1.2639","-1.0826","-0.9838","-1.0128","-0.9954","-0.9623","-1.0794","-1.029","-0.8813","-0.9937","-0.8844","-0.9235","-1.1816","-1.0807","-1.0577","-1.2749","-1.0054"
"0806","Grapes, fresh or dried","-1.1673","-1.2116","-1.1772","-1.5125","-1.0798","-1.0167","-0.9359","-1.0374","-1.0244","-0.9919","-0.9847","-0.9008","-0.868","-1.0024","-0.8738","-0.7313","-0.9084","-1.033","-0.8107","-0.8044","-0.6936","-0.7201","-0.6455","-0.8253","-0.8666"
"0807","Melons (including watermelons) and papayas (papaws), fresh","-1.7621","-1.944","-1.5418","-1.6471","-1.7602","-1.6779","-1.3933","-1.386","-1.6095","-1.6437","-1.5036","-1.6358","-1.4797","-1.5002","-1.4327","-1.483","-1.4431","-1.4858","-1.3207","-1.9068","-1.7206","-1.8602","-1.7544","-1.6731","-1.4739"
"0808","Apples, pears and quinces, fresh","-0.8092","-0.7547","-0.8489","-1.2802","-0.6745","-0.5976","-0.2169","-0.2614","-0.4648","-0.5642","-0.3073","-0.3604","-0.5213","-0.6918","-0.3609","-0.3367","-0.4372","-0.5193","-0.4114","-0.3165","-0.2488","-0.5943","-0.3901","-0.5308","-0.0769"
"0809","Apricots, cherries, peaches (including nectarines), plums (including prune plums) and sloes, fresh","-1.187","-1.3597","-1.4397","-1.6629","-1.1052","-1.0244","-0.9264","-0.9026","-0.8467","-0.6527","-0.6362","-0.6441","-0.762","-0.6765","-0.7857","-0.5717","-0.6891","-0.6239","-0.5616","-0.5797","-0.5975","-0.6067","-0.3825","-0.5436","-0.4863"
"0810","Other fruit, fresh","-1.5722","-1.5364","-1.4919","-1.7729","-1.2945","-1.1754","-1.155","-1.1143","-1.2186","-1.1793","-1.0303","-1.0904","-0.9619","-1.0701","-0.9951","-1.2012","-1.0827","-0.9441","-1.104","-1.1532","-0.9756","-1.0014","-0.9381","-1.0471","-0.9769"
"0811","Fruit and nuts, uncooked or cooked by steaming or boiling in water, frozen, whether or not containing added sugar or other sweetening matter","-0.7523","-0.3805","-0.4659","-0.4675","-0.4743","-0.5023","-0.4441","-0.2638","-0.433","-0.1555","-0.3029","-0.2658","-0.1933","-0.4459","-0.4446","-0.5261","-0.7812","-0.6457","-0.7211","-0.5826","-0.7238","-0.6339","-0.488","-0.4901","-0.6983"
