"2831","Dithionites and sulfoxylates","0.5677","0.6869","0.4292","0.3655","0.8364","0.5542","0.5923","0.4758","0.816","0.2694","-0.2012","0.6015","0.1187","0.3505","0.696","0.3535","0.2003","0.239","-0.183","0.5154","0.76","0.8844","0.5359","0.5257","0.5219"
"2832","Sulfites; thiosulfates","-0.6258","-0.5821","-0.8093","-0.3592","-0.0599","-0.578","-0.5038","-0.5129","-0.8901","-0.5414","0.0484","0.321","-0.1407","-0.3128","-0.1527","-0.4393","-0.778","-0.9122","-0.555","-0.0305","0.1611","0.2618","0.1286","-0.5636","0.4073"
"2833","Sulfates; alums; peroxosulfates (persulfates)","-0.2951","-0.2701","-0.191","-0.2772","0.0043","-0.0647","-0.0472","-0.1805","0.0651","-0.2571","-0.1654","-0.3864","-0.2088","-0.1316","-0.1915","-0.0337","-0.1616","0.0077","-0.2316","-0.0949","-0.3682","-0.3427","-0.4031","-0.42","-0.2159"
"2834","Nitrites; nitrates","0.1023","-0.6569","-0.2774","-0.123","-0.8174","-0.4712","-0.1985","-0.7478","-0.4501","-0.933","-0.6938","-0.6821","0.194","0.199","-0.0278","-0.0433","0.2913","-0.298","0.1575","0.0497","0.1241","0.0888","-0.136","-0.2773","-0.1031"
"2835","Phosphinates (hypophosphites), phosphonates (phosphites) and phosphates; polyphosphates, whether or not chemically defined","0.1024","0.0664","0.1068","-0.1799","-0.3323","0.2078","0.423","0.4018","0.1726","0.0444","0.1111","0.0934","0.1921","-0.013","0.1263","0.0785","0.026","-0.249","0.2738","0.3887","0.4121","0.4796","0.2503","0.4694","0.269"
"2836","Carbonates; peroxocarbonates (percarbonates); commercial ammonium carbonate containing ammonium carbamate","-0.528","-0.836","-0.2967","-0.416","-0.4406","-0.3464","-0.2708","-0.489","-0.1782","-0.3124","-0.1243","-0.4521","-0.3101","-0.1842","-0.4452","0.0374","-0.0876","-0.1107","0.2144","0.3109","0.4552","0.3428","0.3478","-0.1474","-0.249"
"2837","Cyanides, cyanide oxides and complex cyanides","-0.7943","-1.0417","-1.1114","-0.8674","-0.2941","-0.4848","-0.101","0.0376","-0.1745","0.2839","0.6143","-0.6574","-0.0807","0.8242","0.7658","0.9064","0.6956","0.4898","0.1648","0.3457","0.7422","0.6183","0.3604","0.7975","0.7555"
"2838","Fulminates, cyanates and thiocyanates","","","","-0.2658","1.1425","0.0163","-0.3191","1.4218","1.5594","1.3149","0.9671","0.5419","0.2024","1.5008","1.0368","1.3764","1.1713","0.8268","1.6318","1.1493","0.6312","1.3811","1.4794","1.1577","0.6081"
"2839","Silicates; commercial alkali metal silicates","-0.2996","0.1238","0.0259","-0.287","-0.0762","0.0054","-0.2443","0.0104","-0.0749","0.0462","-0.1704","0.1478","-0.0095","0.1985","0.1171","0.1594","-0.2833","-0.1129","-0.472","-0.3598","-0.2722","0.1208","0.3491","0.2497","-0.1042"
"2840","Borates; peroxoborates (perborates)","0.3836","-0.1326","0.154","-0.0858","-0.1136","-0.0542","0.4522","0.4477","-0.1998","0.3852","0.2977","0.6776","0.7616","0.6903","0.4491","0.5272","0.2076","0.2576","0.3959","0.964","1.0036","0.6372","0.8889","0.4898","0.6284"
"2841","Salts of oxometallic or peroxometallic acids","0.1575","-0.1974","-0.3878","-0.3938","-0.1168","-0.1924","-0.3434","-0.3917","0.0472","-0.3108","0.076","-0.1698","-0.299","0.4241","0.2385","0.3736","0.3753","-0.2144","-0.4026","0.3525","0.5987","-0.4342","-0.0828","0.1794","-0.2902"
"2842","Other salts of inorganic acids or peroxoacids (including aluminosilicates whether or not chemically defined), other than azides","1.187","1.372","1.2297","1.3524","0.6979","0.7117","0.6007","0.4758","0.9317","0.7943","1.0791","1.2454","1.009","0.8412","0.8124","1.0625","1.4374","1.4061","1.0617","0.9386","0.6188","0.9401","0.6233","1.0395","2.272"
"2843","Colloidal precious metals; inorganic or organic compounds of precious metals, whether or not chemically defined; amalgams of precious metals","0.9588","1.4906","0.7887","0.4888","1.2688","1.3056","0.8313","0.5389","0.3816","1.0731","0.4309","0.5674","1.1697","1.1019","1.3521","0.5895","1.0212","1.371","1.2005","1.1475","1.1385","0.949","0.5284","0.7261","0.1775"
"2844","Radioactive chemical elements and radioactive isotopes (including the fissile or fertile chemical elements and isotopes) and their compounds; mixtures and residues containing these products","-0.6262","-0.6119","-0.5818","-0.6893","-0.546","-0.6963","-0.9923","-0.6039","-0.6546","-0.8788","-0.8511","-0.5158","-0.4699","-0.1569","0.1306","-0.0533","0.2467","0.0652","0.067","0.0067","0.3058","0.2569","0.4846","-0.0585","-0.5527"
"2845","Isotopes other than those of heading 2844; compounds, inorganic or organic, of such isotopes, whether or not chemically defined","0.6526","1.2302","1.382","0.7568","1.0117","0.5867","1.0511","0.9078","0.896","1.2317","1.1188","0.7319","0.4191","0.3584","1.1476","0.9849","1.117","0.6255","0.5689","0.4872","-0.0483","0.3579","0.942","0.6453","0.1156"
"2846","Compounds, inorganic or organic, of rare-earth metals, of yttrium or of scandium, or of mixtures of these metals","0.3029","1.0809","0.6999","1.0112","0.0767","0.1292","-0.1078","0.2719","0.126","0.3225","-0.2431","0.0584","1.4632","1.119","0.837","0.6173","1.1136","-0.1126","0.4476","0.8849","0.7732","0.4112","0.9099","0.7776","0.2435"
"2847","Hydrogen peroxide, whether or not solidified with urea","0.0103","-0.0845","0.1239","0.17","0.1919","-0.008","0.3258","0.0945","0.1097","0.4589","0.4479","0.546","0.4607","0.8509","0.9658","1.0328","0.8837","1.0186","1.1065","0.8911","1.2477","1.1072","0.9284","0.9042","1.1119"
"2848","Phosphides, whether or not chemically defined, excluding ferrophosphorus","0.7479","0.5907","0.9759","0.7849","0.5644","0.3873","0.1761","0.3734","0.3538","0.059","0.57","0.3963","0.7344","0.1887","0.8488","0.4689","0.0119","0.661","0.6169","0.8033","0.0179","0.1889","0.1213","-0.2466","-0.05"
"2849","Carbides, whether or not chemically defined","0.0045","0.2375","0.2662","0.3686","0.133","0.3569","0.0814","0.2494","0.0428","0.3221","0.2266","0.1692","0.2741","0.6643","0.6229","0.2018","0.5445","0.2793","0.6432","0.1243","0.2286","0.5774","0.4689","0.4535","0.2418"
"2850","Hydrides, nitrides, azides, silicides and borides, whether or not chemically defined, other than compounds which are also carbides of heading 2849 Carbides","1.8426","1.2691","1.6868","1.4512","2.0183","2.0283","1.7133","1.9694","2.2047","1.8864","1.6705","1.479","1.9188","1.6391","1.5054","1.7401","1.6991","1.503","1.1042","1.4566","1.3043","1.2083","1.1205","1.5082","1.2403"
"2851","Inorganic compounds,liquid/compressed air,amalgams ne","2.4069","2.1051","1.4086","0.8874","1.519","1.2857","0.9961","1.2066","1.0568","0.2487","0.632","-0.1131","0.4678","0.9988","1.0344","0.8898","0.292","0.7415","1.2835","1.2141","1.5582","1.1644","0.6441","0.1948","-0.299"
"2901","Acyclic hydrocarbons","0.6443","0.5394","0.3287","0.4337","0.3793","0.2591","0.8205","0.5356","0.2416","0.4515","0.2118","-0.6683","0.0459","0.2465","0.4975","0.5922","-0.1474","0.3071","-0.0064","-0.0793","-0.2962","0.1611","-0.5345","-0.2649","-0.1133"
"2902","Cyclic hydrocarbons","0.7687","0.6428","0.5404","0.4798","0.6793","0.2791","0.6015","0.0339","0.1829","0.6279","0.7164","0.6631","0.4706","0.4682","0.3322","0.3438","0.332","0.4131","0.0166","0.2735","0.2582","0.1337","0.4313","0.6819","0.1549"
"2903","Halogenated derivatives of hydrocarbons","1.2819","1.0902","1.1742","0.7263","1.4749","1.0286","1.107","1.1874","1.0639","1.0237","0.7537","1.0909","1.1912","1.1249","0.7877","0.9297","0.7721","0.4618","0.6261","0.5394","0.5334","0.6634","0.4298","0.5671","0.4882"
"2904","Sulfonated, nitrated or nitrosated derivatives of hydrocarbons, whether or not halogenated","-0.8502","-0.6697","-0.0463","-0.5296","-0.3226","-0.3007","-0.0082","-0.0942","0.2354","0.0476","0.1122","-0.2941","0.2178","0.2943","0.2751","0.0905","-0.0952","0.2994","0.5348","0.54","0.0592","0.0223","0.1393","0.1001","0.3568"
"2905","Acyclic alcohols and their halogenated, sulfonated, nitrated or nitrosated derivatives","-0.587","-0.7994","-0.6422","-0.3982","-0.6525","-0.7313","-0.6996","-0.6633","-0.8611","-0.2091","-0.8668","-0.817","-0.5233","-0.5249","-0.2919","-0.4039","-0.3336","-0.3539","-0.3984","-0.0274","0.0081","0.2719","0.1095","-0.1821","-0.209"
"2906","Cyclic alcohols and their halogenated, sulfonated, nitrated or nitrosated derivatives","1.07","1.0962","1.1974","1.0025","1.1903","1.1446","1.0074","0.6664","0.8384","0.8294","1.2077","1.0585","1.0288","1.1293","1.1879","1.1697","0.6182","0.7554","0.9509","0.8963","1.0534","0.9568","0.3989","0.8254","0.5942"
"2907","Phenols; phenol-alcohols","1.6787","1.6313","1.3612","1.5735","1.6146","1.7009","1.4974","1.5222","1.8664","2.2231","1.3489","2.0114","1.9304","1.9687","1.7829","1.2845","1.7065","1.3736","1.8674","1.7794","1.2466","1.5538","1.4077","1.4435","1.027"
"2908","Halogenated, sulfonated, nitrated or nitrosated derivatives of phenols or phenol-alcohols","1.0594","1.1066","1.0866","1.0526","1.5402","1.4569","1.51","1.3897","0.8321","0.4903","1.1608","0.983","0.9134","1.0094","0.7322","0.8511","1.27","1.3227","1.0774","1.3076","1.0507","1.049","1.2268","1.2682","1.32"
"2909","Ethers, ether-alcohols, ether-phenols, ether-alcohol-phenols, alcohol peroxides, ether peroxides, ketone peroxides (whether or not chemically defined), and their halogenated, sulfonated, nitrated or nitrosated derivatives","0.4121","0.5323","1.1121","0.7616","1.0641","0.5545","0.5809","0.973","0.3967","0.6953","0.8452","0.5205","0.7709","0.6331","0.7011","0.521","0.131","0.2674","0.4347","0.1194","0.3906","0.0259","0.1604","0.1717","0.6605"
"2910","Epoxides, epoxyalcohols, epoxyphenols and epoxyethers, with a three-membered ring, and their halogenated, sulfonated, nitrated or nitrosated derivatives","1.9169","1.5578","1.3099","1.5373","1.6091","1.8566","1.5765","1.5367","1.6802","1.8969","1.619","2.1332","1.5888","1.5053","1.6082","1.2169","0.7504","1.2096","0.8681","0.8934","1.5513","1.449","1.4522","1.2464","1.2208"
"2911","Acetals and hemiacetals, whether or not with other oxygen function, and their halogenated, sulfonated, nitrated or nitrosated derivatives","1.0337","0.9063","0.0433","0.5099","0.9412","0.5578","1.0584","0.2015","0.6199","1.4039","1.4467","1.026","0.9533","0.8208","1.3462","1.9992","1.5849","1.1349","0.994","0.7037","1.3014","1.1266","1.9354","0.6744","1.5334"
"2912","Aldehydes, whether or not with other oxygen function; cyclic polymers of aldehydes; paraformaldehyde","1.1273","1.0369","0.9902","1.0715","0.7444","1.1147","1.6141","0.7101","1.4136","1.1208","0.7271","0.9711","1.3616","1.1297","1.0975","1.6387","1.2349","1.1363","0.9806","1.3214","1.408","1.3298","1.071","1.1606","1.032"
"2913","Halogenated, sulfonated, nitrated or nitrosated derivatives of products of heading 2912","0.2506","1.2213","1.7543","1.5299","1.8431","1.4773","1.0932","1.1034","1.2184","1.6201","2.0111","1.9669","1.8073","1.084","1.7208","1.0737","1.8819","2.2105","1.9556","1.6951","1.704","1.688","1.683","1.6224","1.318"
"2914","Ketones and quinones, whether or not with other oxygen function, and their halogenated, sulfonated, nitrated, or nitrosated derivatives","1.0761","1.3911","1.5455","1.5605","1.7093","1.6843","1.6465","1.5459","1.4783","1.6664","1.4414","1.3531","1.2035","1.6022","1.2312","1.4472","1.4604","1.5679","1.2167","1.5147","1.3878","1.4052","1.2851","1.2943","1.063"
"2915","Saturated acyclic monocarboxylic acids and their anhydrides, halides, peroxides and peroxyacids; their halogenated, sulfonated, nitrated or nitrosated derivatives","1.2557","1.2104","1.2268","1.2654","1.242","1.2381","0.8704","0.853","1.0631","1.4366","1.4809","0.9964","1.3517","1.2473","1.1774","1.1011","1.1992","1.2266","1.3053","1.0444","1.0025","0.9355","0.7807","0.8607","1.0343"
"2916","Unsaturated acyclic monocarboxylic acids, cyclic monocarboxylic acids, their anhydrides, halides, peroxides and peroxyacids; their halogenated, sulfonated, nitrated or nitrosated derivatives","1.2147","1.1648","1.1726","1.2657","1.4509","1.2689","1.3566","1.0722","1.2837","1.265","1.4112","1.2091","1.1369","1.2979","0.863","1.2628","1.2532","1.3905","1.3952","1.0648","1.0767","1.5096","1.5483","1.1282","1.3733"
"2917","Polycarboxylic acids, their anhydrides, halides, peroxides and peroxyacids; their halogenated, sulfonated, nitrated or nitrosated derivatives","0.7702","0.8582","0.7304","0.6478","0.4409","0.7233","1.0304","0.91","0.6331","0.845","0.6381","0.281","0.0069","-0.1198","0.2326","0.7135","0.5241","0.6229","0.422","0.5595","0.3122","0.448","0.478","0.5791","0.2067"
"2918","Carboxylic acids with additional oxygen function and their anhydrides, halides, peroxides and peroxyacids; their halogenated, sulfonated, nitrated or nitrosated derivatives","0.6366","0.5527","0.5088","0.487","0.4446","0.6078","0.7916","0.3897","0.4282","0.6175","0.9708","1.0496","0.7731","1.0847","1.0586","0.8719","0.8944","1.4733","1.0011","0.7369","0.8134","0.9543","1.1169","0.2402","0.7377"
"2919","Phosphoric esters and their salts, including lactophosphates; their halogenated, sulfonated, nitrated or nitrosated derivatives","2.1862","1.9972","1.4686","0.8141","0.656","1.7106","1.6588","0.923","1.4758","1.292","1.194","1.6482","1.6974","1.7306","1.3322","1.3444","1.2103","1.6788","1.8943","1.4589","1.4807","1.2047","1.5989","1.5258","1.4011"
"2920","Esters of other inorganic acids of nonmetals (excluding esters of hydrogen halides) and their salts; their halogenated, sulfonated, nitrated or nitrosated derivatives","2.2873","1.6169","1.6612","1.147","1.773","1.8761","1.7644","1.7178","1.4373","1.8355","1.4299","1.5669","1.2263","1.1136","0.6711","1.1874","1.0503","1.1079","1.6742","1.5366","1.9727","1.3458","1.7987","1.5234","1.7434"
"2921","Amine-function compounds","1.2982","1.4199","1.1734","1.6744","1.4789","1.3113","1.2761","1.0611","1.5048","1.7127","1.5291","1.6465","1.6539","1.4662","1.6315","1.7569","1.9413","1.7937","1.6781","1.3456","1.0509","1.1439","1.1403","0.9208","1.2668"
"2922","Oxygen-function amino-compounds","0.7002","0.6949","0.2119","1.0419","0.4093","0.3725","0.6149","0.4237","0.5456","0.3508","0.9987","0.7713","0.7235","0.9123","0.6436","0.8855","0.6955","0.7856","0.9451","0.9603","0.5824","0.4637","0.5673","0.3665","0.2634"
"2923","Quaternary ammonium salts and hydroxides; lecithins and other phosphoaminolipids, whether or not chemically defined","0.4518","0.6809","0.7203","0.6358","0.8282","0.5266","0.5489","0.7987","0.8228","1.0035","1.3672","0.6834","0.9538","0.8133","0.8948","1.2256","0.8062","1.5504","1.8526","1.3024","1.3315","1.6636","1.9208","2.0796","1.7513"
"2924","Carboxyamide-function compounds; amide-function compounds of carbonic acid","0.515","0.5206","1.1037","0.8236","0.7487","0.8179","0.9603","0.6666","0.6667","0.9064","0.6092","0.8175","0.7281","0.8728","0.9168","0.9874","1.0487","1.5892","1.0226","1.2079","1.3287","1.179","1.0219","0.4745","0.5147"
"2925","Carboxyimide-function compounds (including saccharin and its salts) and imine-function compounds","1.5711","1.638","1.3115","1.2352","1.759","1.7657","1.5772","1.3225","1.5265","1.6592","1.4044","1.8098","1.5474","1.5041","1.7246","1.8991","1.8456","1.4591","1.5183","1.6497","1.7662","1.187","1.4913","1.2001","1.137"
"2926","Nitrile-function compounds","1.1731","1.152","1.6093","1.391","1.3127","1.3993","1.3261","1.6245","1.3715","1.5323","1.3428","1.3438","1.3887","1.2838","1.1406","1.5188","1.2293","1.102","1.3838","1.1054","1.1755","1.0452","1.0454","1.1467","0.9133"
"2927","Diazo-, azo- or azoxy-compounds","0.9888","0.9738","0.8684","0.4793","0.4774","0.5056","0.7212","0.7833","0.6106","0.9237","0.7793","0.9855","0.5394","0.8226","0.4596","1.1523","0.873","0.9882","0.5592","0.3061","0.7458","0.6004","0.3714","0.6538","0.6527"
"2928","Organic derivatives of hydrazine or of hydroxylamine","1.0409","1.0324","0.6476","1.412","1.3029","0.6546","0.9987","1.0167","0.8646","1.0538","0.6104","0.7426","1.0878","1.4215","0.9643","0.9363","1.0474","1.2425","1.3414","1.4308","1.0756","1.1452","1.2657","1.2804","1.2886"
"2929","Compounds with other nitrogen function","1.1516","1.1591","0.8377","0.7061","1.0917","1.4294","1.2291","0.5247","0.8575","0.5576","1.2069","0.7872","0.6687","1.063","1.0172","1.1726","0.8161","0.7022","1.0515","0.9856","1.4307","1.081","1.2546","0.9429","0.5538"
"2930","Organo-sulfur compounds","1.2243","1.2886","1.3347","1.5135","1.0688","1.8104","1.3855","1.7313","1.35","1.5586","1.9399","1.035","0.979","1.5902","1.2669","0.9513","1.2348","1.537","2.0113","1.837","1.6727","1.3008","1.4365","1.1287","0.9911"
"2931","Other organo-inorganic compounds","1.5926","1.7777","1.7834","1.5279","1.4914","1.5501","1.369","0.9565","1.17","1.0322","1.123","1.1134","0.9975","1.8807","1.181","1.5708","1.8608","1.419","1.7384","1.9022","1.2624","1.4411","2.1217","1.1908","1.2324"
"2932","Heterocyclic compounds with oxygen hetero-atom(s) only","0.969","0.8189","0.7995","0.3896","0.9301","0.7135","1.0668","0.9791","1.2646","1.3903","1.2303","1.0259","1.2176","0.7221","1.0566","0.7087","1.037","1.2418","1.09","1.0174","0.7502","0.7193","0.8833","0.3039","0.2587"
"2933","Heterocyclic compounds with nitrogen hetero-atom(s) only","0.799","1.1704","0.9509","1.1114","0.5247","0.9635","1.361","1.1544","1.3126","1.2287","1.1635","0.9848","0.9157","1.1625","1.0918","1.5333","1.0899","1.4082","1.5181","1.831","1.332","1.4173","1.0724","0.8203","0.5234"
"2934","Nucleic acids and their salts, whether or not chemically defined; other heterocyclic compounds","1.6354","1.6163","1.5792","1.7644","1.4532","1.7308","1.5405","1.3454","1.4852","1.5313","2.008","2.4549","1.7228","2.2471","2.3654","2.3619","1.931","1.7789","2.3513","2.3271","1.7801","2.1598","2.4157","1.5134","1.9573"
"2935","Sulfonamides","1.4814","1.6166","1.2667","1.438","1.415","1.0732","1.2903","1.3757","1.402","1.4164","1.9962","1.3944","1.2049","1.2635","1.6996","1.48","1.5581","1.6171","1.4578","1.1985","0.9681","0.8802","0.5134","0.7246","0.1783"
"2936","Provitamins and vitamins, natural or reproduced by synthesis (including natural concentrates), derivatives thereof used primarily as vitamins, and intermixtures of the foregoing, whether or not in any solvent","0.8852","1.0921","1.1568","1.1061","0.9087","0.6883","0.7367","0.4344","0.7855","0.7269","0.965","1.1062","0.4787","0.5937","0.9851","0.9127","0.6586","0.8901","0.7556","0.5387","1.0401","0.9138","1.1488","0.6651","0.7328"
"2937","Hormones, prostaglandins, thromboxanes and leukotrienes, natural or reproduced by synthesis; derivatives and structural analogues thereof, including chain modified polypeptides, used primarily as hormones","0.9534","1.24","1.445","1.4732","1.3892","1.5645","2.0815","1.7889","1.7489","1.8186","1.7585","1.6708","1.7519","1.4637","1.4238","1.5088","2.1046","1.9171","2.1453","1.6812","1.8347","1.5968","1.7042","1.0468","1.1452"
"2938","Glycosides, natural or reproduced by synthesis, and their salts, ethers, esters and other derivatives","-0.4353","-0.0599","0.1988","-0.1982","-0.2019","-0.1366","0.5806","-0.4365","0.0327","0.0883","0.6051","0.9699","0.7966","0.6018","0.0554","0.3936","0.3471","0.6209","-0.0278","0.2139","0.5798","0.7589","0.8186","0.8219","0.8791"
"2939","Vegetable alkaloids, natural or reproduced by synthesis, and their salts, ethers, esters and other derivatives","0.5333","0.5337","0.031","-0.1596","-0.0449","-0.0743","0.4231","0.1549","0.5423","0.1358","0.3376","0.8606","0.3269","0.1983","-0.144","0.1012","0.4414","0.4893","0.3507","0.4281","0.5546","0.8636","0.4649","0.732","0.4063"
"2940","Sugars, chemically pure, other than sucrose, lactose, maltose, glucose and fructose; sugar ethers, sugar acetals and sugar esters, and their salts, other than products of heading 2937, 2938 or 2939:","1.0164","1.2051","0.508","0.6344","0.9517","0.9446","0.6462","0.9604","1.2384","1.4337","1.0691","0.9191","1.0192","1.2858","1.2831","1.1206","1.2406","1.5783","0.9668","1.7812","1.4842","1.6278","1.6192","1.7622","1.4403"
"2941","Antibiotics","1.097","0.9199","0.833","0.7329","0.6987","0.9028","0.9529","0.7445","1.0136","0.7569","0.803","1.0938","1.0275","0.7767","1.0467","0.55","0.9495","0.942","0.5743","0.9018","0.5927","0.6788","0.0879","0.6364","0.4079"
"2942","Other organic compounds","-0.426","-0.653","-0.6842","0.0504","0.0725","-0.2747","-0.1875","0.1398","0.2145","0.4438","-0.4252","-0.2414","-0.149","0.0874","-0.5547","0.2308","0.317","0.1246","-0.4601","-0.0718","-0.5685","-0.0113","0.1635","0.3921","-0.004"
"3001","Glands and other organs for organotherapeutic uses, dried, whether or not powdered; extracts of glands or other organs or of their secretions for organotherapeutic uses; heparin and its salts; other human or animal substances prepared for therapeutic or p","0.6177","0.8189","0.818","0.7554","0.6832","1.0608","1.2231","1.0969","1.1546","1.2133","1.2901","0.9584","0.6707","0.8198","1.0335","1.2322","0.8059","0.3502","0.544","0.4703","1.043","0.9334","1.0577","1.1032","0.7232"
"3002","Human blood; animal blood prepared for therapeutic, prophylactic or diagnostic uses; antisera and other blood fractions and modified immunological products, whether or not obtained by means of biotechnological processes; vaccines, toxins, cultures of micr","1.2763","1.1958","1.3848","1.2873","1.1976","1.442","1.6897","1.3594","1.3524","1.5973","1.2421","1.5685","1.3781","1.6845","1.2991","1.739","1.3881","0.8989","0.8412","0.7432","1.0392","1.0399","0.6957","0.6582","0.8293"
"3003","Medicaments (excluding goods of heading 3002, 3005 or 3006) consisting of two or more constituents which have been mixed together for therapeutic or prophylactic uses, not put up in measured doses or in forms or packings for retail sale","0.6462","0.3444","0.1446","0.3059","0.045","0.0597","0.1101","-0.0442","0.1885","0.0589","0.5109","0.1515","0.0472","0.6002","0.4383","0.3777","0.4203","0.1394","0.3622","0.3777","0.748","0.6035","0.2915","-0.0124","0.3112"
"3004","Medicaments (excluding goods of heading 3002, 3005 or 3006) consisting of mixed or unmixed products for therapeutic or prophylactic uses, put up in measured doses (including those in the form of transdermal administration systems) or in forms or packings","0.8494","0.7122","0.8452","0.6048","0.5182","0.6654","0.7114","0.6383","0.7473","0.8001","0.9993","0.9131","1.03","0.9065","0.6758","0.8231","1.0419","0.9506","0.6908","0.5251","0.6119","0.4745","0.4217","0.3871","0.3448"
"3005","Wadding, gauze, bandages and similar articles (for example, dressings, adhesive plasters, poultices), impregnated or coated with pharmaceutical substances or put up in forms or packings for retail sale for medical, surgical, dental or veterinary purposes","0.6095","0.7835","0.823","0.7415","0.4029","0.5816","0.3787","0.4746","0.5262","0.6582","0.3427","0.3927","0.3796","0.4007","0.5278","0.7064","0.8829","0.9648","0.8904","0.4835","0.3198","0.5633","0.5085","0.4664","0.3772"
"3006","Pharmaceutical goods specified in note 4 to this chapter","0.5852","0.6504","0.8982","1.0812","1.0836","1.2275","0.7799","0.8855","0.9413","0.6966","1.1686","1.4411","1.2725","0.6198","0.8816","0.9986","0.963","1.3922","1.4299","1.2446","1.3736","1.782","1.324","0.8679","1.4735"
"3101","Animal or vegetable fertilizers, whether or not mixed together or chemically treated; fertilizers produced by the mixing or chemical treatment of animal or vegetable products","-0.6738","-0.4681","-0.7982","-0.6022","-0.171","-0.6293","-0.4219","-0.6688","-0.9331","-0.5508","-0.798","-0.6302","-0.6172","-0.5777","-0.7928","-0.3845","-0.5142","-0.8448","-0.7912","-0.646","-1.0292","-0.9662","-0.6456","-0.6717","-0.2424"
"3102","Mineral or chemical fertilizers, nitrogenous","-1.109","-1.4065","-1.3784","-1.2968","-1.1606","-1.0517","-0.9792","-0.9873","-1.0198","-0.9","-1.2068","-1.2279","-0.7593","-1.0656","-0.7273","-0.859","-0.7917","-0.8209","-0.887","-0.7204","-0.9179","-0.7201","-0.6224","-0.7754","-0.8953"
"3103","Mineral or chemical fertilizers, phosphatic","-1.0736","-0.869","-1.0486","-1.3535","-0.9105","-0.8689","-1.1028","-0.6195","-0.7402","-1.0592","-0.9386","-0.9","-0.6525","-0.9048","-0.3579","-0.8239","-0.8648","-0.8754","-0.7723","-0.7458","-0.7627","-0.686","-0.6504","-0.8649","-0.7502"
"3104","Mineral or chemical fertilizers, potassic","-0.6676","-1.0881","-0.5572","-0.7762","-0.5584","-0.1492","-0.5934","-0.547","-0.3114","0.2233","0.0983","0.2964","-0.258","0.2557","0.2618","-0.1343","-0.5269","0.3932","-0.0147","0.0289","0.1356","0.4498","-0.015","0.3086","-0.2111"
"3105","Mineral or chemical fertilizers containing two or three of the fertilizing elements nitrogen, phosphorus and potassium; other fertilizers; goods of this chapter in tablets or similar forms or in packages of a gross weight not exceeding 10 kg","-0.8135","-0.8525","-0.8102","-1.0396","-0.785","-0.6846","-0.938","-0.5973","-0.7627","-0.6373","-0.8956","-0.7427","-0.4711","-0.4215","-0.4833","-0.3894","-0.5776","-0.7673","-0.7284","-0.7231","-0.4974","-0.5295","-0.3028","-0.6133","-0.5655"
"3201","Tanning extracts of vegetable origin; tannins and their salts, ethers, esters and other derivatives","-1.1306","-1.3146","-1.2834","-1.0325","-0.8291","-1.003","-0.9507","-1.1025","-1.2337","-1.1824","-1.4619","-1.0719","-1.0668","-0.9889","-1.1167","-0.8952","-1.1313","-0.8384","-0.5962","-0.4656","-1.0055","-1.1288","-0.7744","-0.8526","-0.8208"
"3202","Synthetic organic tanning substances; inorganic tanning substances; tanning preparations, whether or not containing natural tanning substances; enzymatic preparations for pre-tanning","-0.3186","-0.0135","-0.403","-0.4277","-0.2043","-0.4757","-0.0993","-0.2441","-0.0332","-0.0688","-0.0021","-0.3234","-0.2306","-0.4006","0.1674","-0.076","-0.2904","-0.0251","-0.2531","0.1067","-0.022","0.1477","0.1927","0.0455","-0.2432"
