"5105","Wool and fine or coarse animal hair, carded or combed (including combed wool in fragments)","-1.1763","-1.2676","-1.0319","-1.1466","-1.2469","-0.9758","-1.1863","-0.928","-0.8191","-0.709","-1.165","-0.9286","-0.7484","-0.6409","-0.4115","-0.383","-0.3161","-0.2531","-0.2641","-0.0083","-0.1266","-0.4058","-0.1067","-0.2264","-0.1818"
"5106","Yarn of carded wool, not put up for retail sale","0.2278","0.1408","0.4281","0.1392","0.1198","0.1708","-0.2537","0.1486","0.1323","-0.1625","-0.2912","-0.007","-0.1984","-0.371","-0.2081","-0.3403","-0.3139","-0.4519","-0.3215","-0.3316","-0.3401","-0.2192","-0.3045","-0.012","-0.0672"
"5107","Yarn of combed wool, not put up for retail sale","0.5233","0.5466","0.4133","0.2587","0.2243","0.4773","0.0815","0.306","0.2346","0.1074","0.2063","-0.0243","-0.0219","-0.2703","-0.1588","-0.1233","-0.012","-0.3029","-0.1705","-0.3517","-0.1894","0.0597","-0.0155","-0.0543","0.0696"
"5108","Yarn of fine animal hair (carded or combed), not put up for retail sale","-0.0807","-0.6616","-0.7266","-0.8585","-0.3271","-0.2256","-0.7416","-0.193","-0.3011","-0.7962","-0.8692","-0.6544","-0.8234","-0.8023","-0.8415","-0.2646","-0.7093","-0.7815","-0.4413","-0.2741","-0.714","-0.0551","0.0805","-0.2679","0.1734"
"5109","Yarn of wool or of fine animal hair, put up for retail sale","-0.0206","-0.4623","-0.0326","-0.2646","-0.1095","0.0599","-0.2624","-0.2952","-0.2393","-0.2695","-0.2886","-0.6581","-0.693","-1.317","-1.1842","-0.8393","-0.4635","-0.691","-0.2763","-0.469","-0.2335","-0.2566","0.081","-0.246","-0.0545"
"5110","Yarn of coarse animal hair or of horsehair (including gimped horsehair yarn), whether or not put up for retail sale","0.1125","-0.0205","0.4187","0.31","-0.0464","0.0776","0.1297","-0.2859","-0.1418","0.1946","-0.4553","0.5987","0.1708","-0.262","-0.5052","0.4689","-0.0807","-0.4808","-0.7374","-0.4599","-0.4278","0.2041","-0.1131","0.0996","0.0953"
"5111","Woven fabrics of carded wool or of carded fine animal hair","0.5014","0.3669","0.3288","0.0765","0.3651","0.5105","0.3876","0.6117","0.7382","0.4797","0.2795","0.5001","0.2185","0.3399","0.4912","0.5933","0.1328","0.1331","-0.003","0.0696","0.42","0.4175","0.2164","0.4574","0.0903"
"5112","Woven fabrics of combed wool or of combed fine animal hair","0.6132","0.5072","0.5979","0.4174","0.1595","0.3733","-0.0136","0.4031","0.3467","0.5937","0.2944","0.622","0.0239","0.0165","0.1111","0.1843","0.2562","0.4411","0.1838","0.3365","0.1721","0.1505","0.3141","0.1474","0.2879"
"5113","Woven fabrics of coarse animal hair or of horsehair","-0.7209","0.1251","0.2141","0.1002","-0.0162","-0.1007","0.0606","0.2312","0.1515","0.0225","0.4189","0.6981","0.557","0.276","0.6023","0.1242","0.1111","0.0985","0.0319","-0.0157","0.4921","-0.0956","0.6119","0.04","0.1435"
"5201","Cotton, not carded or combed:","-2.4161","-2.5226","-2.4363","-2.4664","-2.1839","-2.1638","-2.5388","-2.4105","-2.4306","-2.415","-2.4565","-2.354","-2.063","-2.1283","-2.1453","-1.9275","-2.2296","-2.085","-2.3208","-2.4016","-2.1202","-2.1639","-2.301","-2.1415","-2.0829"
"5202","Cotton waste (including yarn waste and garnetted stock)","-1.7422","-1.8785","-2.0954","-1.8671","-1.6537","-1.9162","-2.0441","-2.032","-1.7698","-2.0297","-1.7487","-1.743","-2.0751","-1.9163","-1.9371","-1.4915","-1.7612","-1.6523","-1.4501","-1.5591","-1.5771","-1.4902","-1.6406","-1.549","-1.2362"
"5203","Cotton, carded or combed:","-1.1622","-1.2062","-1.035","-1.6677","-1.5588","-1.509","-1.7771","-1.9157","-2.1473","-2.2569","-1.8472","-1.779","-1.9878","-1.8205","-2.1793","-1.7598","-1.8638","-1.7555","-1.8495","-1.7038","-1.873","-1.5871","-1.8842","-1.605","-1.5081"
"5204","Cotton sewing thread, whether or not put up for retail sale","-1.3751","-1.1235","-1.2379","-1.0301","-0.7574","-1.0181","-0.7243","-1.0106","-0.9176","-1.0972","-1.2968","-1.4061","-1.3082","-1.0675","-1.152","-1.0721","-1.2795","-1.3086","-1.0388","-1.3411","-1.2568","-1.3837","-1.097","-0.8369","-0.7259"
"5205","Cotton yarn (other than sewing thread), containing 85 per- cent or more by weight of cotton, not put up for retail sale","-1.7894","-1.7745","-1.7563","-1.7019","-2.0538","-1.8621","-1.9334","-1.5645","-1.7734","-1.4371","-1.439","-1.729","-1.6613","-1.87","-1.8296","-1.8006","-1.472","-1.2964","-1.4217","-1.3738","-1.5095","-1.4472","-1.5115","-1.2283","-1.299"
"5206","Cotton yarn (other than sewing thread), containing less than 85 percent by weightof cotton, not put up for retail sale","-0.6846","-1.1272","-0.8119","-0.8377","-0.8404","-0.5482","-0.9762","-0.7611","-0.8936","-0.7272","-0.7428","-0.9366","-0.5012","-0.7987","-1.2671","-1.4086","-1.3146","-1.4377","-1.1395","-1.3948","-1.2179","-1.1907","-1.0727","-1.1247","-0.8365"
"5207","Cotton yarn (other than sewing thread) put up for retail sale","-0.3253","-0.2447","-0.7945","-0.6691","-0.9356","-0.5581","-0.7221","-0.816","-1.0486","-0.9233","-0.885","-0.6229","-0.8409","-1.1764","-1.4253","-1.3917","-0.7232","-1.714","-1.5037","-1.5252","-1.5458","-1.3849","-1.4049","-1.0426","-1.1674"
"5208","Woven fabrics of cotton, containing 85 percent or more by weight of cotton, weighing not more than 200 g/m2","-1.1654","-1.0607","-1.6044","-1.2291","-1.2148","-1.2567","-1.5888","-1.5176","-1.4921","-1.3801","-1.424","-1.2493","-1.4136","-1.533","-1.1789","-1.3406","-0.9737","-1.2198","-1.3524","-1.3413","-1.3905","-1.3944","-1.6523","-1.4099","-1.3178"
"5209","Woven fabrics of cotton, containing 85 percent or more by weight of cotton, weighing more than 200 g/m2","-1.3425","-1.46","-1.4446","-1.4735","-1.6148","-1.2946","-1.4915","-1.1187","-1.4431","-1.5175","-1.3501","-1.3609","-1.4259","-1.5216","-1.42","-1.3571","-1.1937","-1.3225","-1.3011","-1.3027","-1.1714","-1.0791","-1.0593","-0.9553","-1.0781"
"5210","Woven fabrics of cotton, containing less than 85 percent by weight of cotton, mixed mainly or solely with man-made fibers, weighing not more than 200 g/m2","-0.7235","-0.9923","-0.6096","-0.4476","-0.4483","-0.5423","-0.7132","-0.4792","-0.6915","-0.4431","-0.4887","-0.1049","-0.2992","-0.6052","-0.6809","-0.298","-0.4311","-0.6783","-0.6558","-0.6894","-0.7041","-0.6368","-0.1798","-0.2158","-0.5997"
"5211","Woven fabrics of cotton, containing less than 85 percent by weight of cotton, mixed mainly or solely with man-made fibers, weighing more than 200 g/m2","-0.8078","-0.4972","-0.5534","-0.8448","-0.83","-1.0282","-0.7445","-0.2686","-0.661","-0.8602","-0.8348","-0.6362","-0.4553","-0.7678","-0.7492","-0.7127","-0.5823","-0.8253","-0.557","-0.7177","-0.6303","-0.681","-0.6852","0.0109","-0.1727"
"5212","Other woven fabrics of cotton","-0.6736","-0.6512","-0.9991","-0.6339","-0.4417","-1.1669","-1.2906","-0.9745","-1.1171","-1.3639","-1.2041","-1.0879","-1.172","-1.0202","-1.3089","-0.8782","-0.9518","-1.0972","-1.4619","-1.1765","-1.334","-1.3129","-1.1048","-0.7645","-0.9283"
"5301","Flax, raw or processed but not spun; flax tow and waste (including yarn waste and garnetted stock)","0.2327","0.3741","0.1652","0.2022","0.216","-0.0518","0.6779","-0.3829","0.1597","0.575","-0.5932","-0.467","-0.2973","-0.2293","-0.1166","0.0213","0.3182","-0.8687","-0.5841","-0.6063","-0.8144","-0.0967","0.3602","-0.0095","0.1781"
"5302","True hemp (Cannabis sativa L.), raw or processed but not spun; tow and waste of true hemp (including yarn waste and garnetted stock)","0.5919","0.2336","-0.1346","-0.8046","-0.2536","0.0264","-0.1141","-0.0761","-0.6232","-0.7424","-0.7429","-0.683","-0.1898","0.4654","-0.608","0.3778","-0.0421","-0.2929","-0.2431","-0.6215","-0.0913","-0.0802","-0.0081","-0.3983","0.0647"
"5303","Jute and other textile bast fibers (excluding flax, true hemp and ramie), raw or processed but not spun; tow and waste of these fibers (including yarn waste and garnetted stock)","-2.1199","-1.8557","-3.0841","-2.5318","-2.1071","-2.0696","-2.7605","-2.3663","-2.8126","-2.8477","-2.7186","-2.4197","-2.505","-2.7562","-2.4476","-2.3491","-2.4059","-2.891","-2.1045","-1.9355","-2.1846","-2.6317","-2.4504","-2.3608","-2.6748"
"5304","Sisal and Agave, raw","","","","-2.2939","-1.3223","-1.7188","-1.8215","-1.5335","-2.0793","-2.0625","-1.8726","-0.9555","-2.5092","-2.4215","-2.6214","-2.3137","-1.8489","-2.355","-1.5923","-1.485","-1.7181","-1.9357","-2.3601","-2.1708","-1.8883"
"5305","Coconut, abaca (Manila hemp or Musa textilis Nee), ramie and other vegetable textile fibers,not elsewhere specified or included, raw or processed but not spun; tow, noils and waste of these fibers (including yarn waste and garnetted stock)","-1.9278","-1.6837","-1.9693","-1.7787","-1.6368","-2.0767","-2.0825","-2.0638","-2.1354","-1.8014","-1.5918","-1.9857","-2.4447","-1.9939","-1.8445","-1.8641","-1.9382","-1.9722","-1.6393","-1.8824","-1.8413","-1.8428","-1.7086","-1.8034","-1.8025"
"5306","Flax yarn","-0.0057","0.1929","0.2841","-0.071","-0.0005","-0.0815","-0.0956","-0.0016","0.2475","-0.1648","0.0023","0.416","0.6202","0.3642","0.4765","0.5637","0.3643","0.4703","0.433","0.1574","0.3432","0.4143","0.3463","0.1919","0.0404"
"5307","Yarn of jute or of other textile bast fibers of heading 5303","-1.6186","-1.4113","-2.007","-2.11","-1.9226","-1.1279","-1.9356","-2.108","-1.4132","-2.1023","-2.0756","-1.3741","-1.4419","-1.3162","-1.3708","-1.9264","-1.3017","-2.3411","-1.3961","-1.1649","-1.6554","-1.4822","-1.6623","-1.5045","-1.5425"
"5308","Yarn of other vegetable textile fibers; paper yarn","-0.789","-0.6912","-0.6462","-0.6777","-0.6754","-0.8211","-0.9961","-1.6164","-1.4071","-1.1548","-0.9856","-0.8178","-0.9297","-1.0807","-1.099","-1.3716","-1.6207","-1.3865","-1.6312","-1.4878","-1.2774","-1.4207","-1.3564","-1.1406","-1.3437"
"5309","Woven fabrics of flax","0.4403","0.7464","0.5527","0.5545","0.3829","0.6281","0.6511","0.6423","0.4886","0.1159","0.1455","0.4627","0.3905","0.2128","0.2735","0.3051","0.4311","0.3106","0.4054","0.3757","0.3675","0.3576","0.302","0.4779","0.43"
"5310","Woven fabrics of jute or of other textile bast fibers of heading 5303","-2.1483","-1.9233","-2.138","-2.3951","-2.268","-2.1295","-1.674","-2.187","-2.1766","-2.341","-2.1749","-2.1775","-2.4096","-1.8916","-2.2247","-2.6035","-1.88","-2.4212","-1.347","-1.3578","-1.6613","-1.7175","-1.3501","-1.5807","-1.2359"
"5311","Woven fabrics of other vegetable textile fibers; woven fabrics of paper yarn:","-0.6686","-0.2408","-0.8819","-1.0821","-0.4662","-0.5319","-0.4263","-0.0947","-0.4271","-0.7477","-1.1281","-0.8375","-0.7478","-0.6933","-1.3035","-1.1756","-0.8897","-0.8437","-1.7809","-1.2272","-1.3154","-0.4301","-0.984","-0.8805","-0.9785"
"5401","Sewing thread of man-made filaments, whether or not put up for retail sale","-0.3114","-0.2322","-0.3789","-0.5495","-0.4003","-0.3773","-0.5687","-0.5466","-0.4007","-0.4815","-0.6554","-0.3486","-0.2687","-0.4368","-0.3093","-0.3044","-0.617","0.0147","-0.2281","-0.0453","0.0007","-0.0303","-0.2164","-0.1713","0.1801"
"5402","Synthetic filament yarn (other than sewing thread), not put up for retail sale, including synthetic monofilament of less than 67 decitex","0.378","0.1899","0.3806","0.4503","0.645","0.3765","0.544","0.3703","0.1403","0.1985","0.1051","0.2506","0.2089","0.4551","0.4448","0.1227","0.4189","0.3848","0.459","0.5421","0.4797","0.3412","0.0996","0.3404","0.3061"
"5403","Artificial filament yarn (other than sewing thread), not put up for retail sale, including artificial monofilament of less than 67 decitex","0.5589","0.5598","-0.0514","0.2247","0.4128","0.7049","0.6008","0.4547","0.3748","0.4059","0.3253","0.363","0.1169","0.0742","0.3479","0.496","0.0964","0.5053","0.8276","0.2384","0.6442","0.4656","0.2372","0.2139","0.0182"
"5404","Synthetic monofilament of 67 decitex or more and of which no cross-sectional dimension exceeds 1 mm; strip and the like (for example, artificial straw) of synthetic textile materials of an apparent width not exceeding 5 mm","0.2802","0.6348","0.5173","0.3697","0.4254","0.5449","0.4951","0.4499","0.5396","0.7958","0.5185","0.6495","0.6002","1.097","1.2592","0.4874","0.6744","0.566","0.7846","0.8209","0.6708","0.5992","0.827","0.5623","0.6939"
"5405","Artificial monofilament of 67 decitex or more and of which no cross-sectional dimension exceeds 1 mm; strip and the like (for example, artificial straw) of artificial textile materials of an apparent width not exceeding 5 mm:","0.7728","0.7967","1.0476","1.3138","0.7567","0.7094","0.692","0.5328","0.9918","0.031","0.6232","0.461","0.5262","0.0888","-0.1487","0.8562","0.115","0.3111","0.4541","0.9289","0.5054","0.2932","0.2246","0.1275","-0.0221"
"5406","Man-made filament yarn (other than sewing thread), put up for retail sale:","0.0524","-0.546","-0.5088","-0.5099","0.2006","-0.4722","0.1598","-0.4795","-0.7979","-0.6754","-0.8761","-0.6044","-0.3708","-0.4034","-0.6258","-0.2723","0.0588","0.0408","-0.2744","-0.3968","-0.6367","-0.9572","-0.4547","-0.7828","-0.7395"
"5407","Woven fabrics of synthetic filament yarn, including woven fabrics obtained from materials of heading 5404","-0.267","-0.3204","-0.2629","-0.3858","-0.3769","0.0219","0.0339","-0.0687","-0.3828","-0.1029","-0.1991","-0.2464","-0.3126","-0.3658","-0.4978","-0.1601","-0.3445","-0.3887","-0.633","-0.6269","-0.8719","-1.0249","-0.7449","-0.6091","-0.7741"
"5408","Woven fabrics of artificial filament yarn, including woven fabrics obtained from materials of heading 5405","-0.0844","0.0268","-0.0529","-0.1824","0.0305","-0.236","-0.1086","0.001","-0.0653","-0.415","-0.1085","-0.1107","0.0215","-0.0917","-0.0057","-0.0295","-0.0071","0.3759","-0.0455","-0.042","-0.2705","0.1956","0.1582","0.0714","-0.1996"
"5501","Synthetic filament tow","0.2799","-0.0965","0.1741","0.1397","0.2453","0.2852","-0.2704","0.6399","0.1989","0.1834","-0.3707","0.1734","0.0031","0.0071","0.6766","0.332","0.7782","0.6106","0.2839","0.2266","0.4492","-0.0568","0.0572","0.4035","0.0706"
"5502","Artificial filament tow","1.486","1.4607","1.3283","1.5631","1.6003","1.3332","0.9371","1.1097","1.5071","1.2764","0.1664","1.0887","1.1399","1.2866","1.3315","0.8836","1.5702","1.0157","1.2596","1.5158","1.1068","1.0375","1.0335","1.1404","0.7817"
"5503","Synthetic staple fibers, not carded, combed or otherwise processed for spinning","0.3416","0.4629","0.4731","0.3698","0.2889","0.185","-0.137","0.22","0.1118","-0.0124","0.1895","0.3181","0.1446","0.459","0.1235","0.0577","0.0449","0.4239","0.1453","0.2595","0.1916","0.0046","0.1994","0.4151","0.2739"
"5504","Artificial staple fibers, not carded, combed or otherwise processed for spinning","0.2045","0.4701","0.2566","0.4457","0.3799","0.5578","0.5018","0.6302","0.9234","0.7612","0.6959","0.6479","1.1429","0.7778","0.7934","0.7933","0.7887","1.103","0.8916","1.027","1.3547","0.8198","0.7657","0.8902","0.6126"
"5505","Waste (including noils, yarn waste and garnetted stock) of man-made fibers","-0.1348","-0.2548","-0.0516","-0.417","-0.1768","-0.0282","-0.1411","-0.109","0.1961","-0.3099","-0.1377","0.085","0.2674","0.3555","-0.2588","-0.1929","-0.0728","0.0231","0.2162","-0.0146","0.1395","-0.1454","-0.087","-0.057","-0.0829"
"5506","Synthetic staple fibers, carded, combed or otherwise processed for spinning","-0.0834","0.5045","0.1156","0.4128","0.3592","-0.2557","-0.0219","-0.3284","-0.1447","-0.4536","-0.458","-0.3664","-0.4539","-0.7346","0.1491","-0.3144","0.1163","-0.0735","-0.1048","-0.2984","-0.3812","-0.1759","-0.4273","-0.1934","-0.4338"
"5507","Artificial staple fibers, carded, combed or otherwise processed for spinning","-0.2889","-0.0549","0.5031","0.6244","0.5607","1.153","0.9593","0.6999","0.1543","0.1651","0.6464","0.2923","-0.2294","0.1888","1.2417","0.8466","-0.0969","0.3699","0.1203","0.0587","-0.2874","0.608","0.1938","-0.4806","0.9919"
"5508","Sewing thread of man-made staple fibers, whether or not put up for retail sale","-1.0359","-0.8332","-1.0389","-0.6429","-0.6311","-0.5303","-0.3802","-0.3071","-0.8507","-1.3006","-0.9016","-0.6681","-0.7756","-0.7985","-1.0276","-1.4502","-1.0905","-0.9402","-1.0253","-1.2752","-0.8394","-1.106","-1.1226","-0.7502","-0.8455"
"5509","Yarn (other than sewing thread) of synthetic staple fibers, not put up for retail sale","-0.2909","-0.4328","-0.4151","-0.5968","-0.5497","-0.4141","-0.4902","-0.3397","-0.5751","-0.5815","-0.4781","-0.5339","-0.6755","-0.7822","-0.883","-0.7654","-0.6028","-0.5372","-0.6705","-0.7803","-0.8332","-0.7417","-0.5497","-0.419","-0.5615"
"5510","Yarn (other than sewing thread) of artificial staple fibers, not put up for retail sale","-0.3037","-0.2788","-0.2046","0.0001","-0.4849","-0.4945","-0.4973","-0.3452","-0.4686","-0.1885","-0.4737","-0.1307","-0.1694","-0.2595","-0.385","-0.4164","-0.506","-0.1813","-0.4698","-0.0775","-0.3562","-0.0098","-0.4338","-0.3019","-0.0372"
"5511","Yarn (other than sewing thread) of man-made staple fibers, put up for retail sale","-0.5702","-0.6042","-0.7698","-0.8708","-0.8483","-0.6752","-0.8566","-0.6862","-0.7854","-0.8186","-0.6534","-0.4788","-0.9103","-0.798","-0.9367","-0.903","-0.5518","-0.4671","-0.5111","-0.3685","-0.2291","-0.6595","-0.3855","-0.1736","-0.5139"
"5512","Woven fabrics of synthetic staple fibers, containing 85 percent or more by weight of synthetic staple fibers","0.1323","-0.1537","-0.4475","-0.4749","-0.071","-0.0975","-0.1341","-0.4791","-0.6086","-0.562","-0.2635","-0.0716","-0.2477","-0.6393","-0.6646","-0.5623","-0.4088","-0.2818","-0.0568","-0.0651","-0.3275","-0.1099","0.2036","-0.25","-0.2378"
"5513","Woven fabrics of synthetic staple fibers, containing less than 85 percent by weight of such fibers, mixed mainly or solely with cotton, of a weight not exceeding 170 g/m2","-1.1874","-1.0305","-0.993","-0.9283","-0.9041","-0.8686","-1.2616","-0.938","-1.2962","-1.0699","-1.1875","-1.4049","-1.4926","-1.3011","-1.3385","-1.2601","-1.4343","-1.3562","-1.3501","-1.2169","-1.3059","-1.2534","-1.1758","-1.2811","-1.1364"
"5514","Woven fabrics of synthetic staple fibers, containing less than 85 percent by weight of such fibers, mixed mainly or solely with cotton, of a weight exceeding 170 g/m2","-0.3187","-0.6566","-0.5061","-0.5609","-0.6229","-0.236","-0.5299","-0.5455","-0.49","-1.0094","-0.927","-0.5071","-0.3428","-0.965","-0.8811","-0.6209","-0.7434","-0.9157","-0.4617","-0.8768","-0.5495","-0.653","-0.6374","-0.6723","-0.6384"
"5515","Other woven fabrics of synthetic staple fibers","-0.5056","-0.5963","-0.6075","-0.3906","-0.628","-0.4386","-0.7915","-0.4733","-0.804","-0.8438","-0.9051","-0.542","-0.4132","-0.782","-0.6091","-0.5743","-0.5616","-0.5523","-0.6355","-0.661","-0.6277","-0.1959","-0.225","-0.4178","-0.5315"
"5516","Woven fabrics of artificial staple fibers","-0.2583","-0.075","-0.6963","-0.9243","-0.7902","-0.5972","-0.4009","-0.3063","0.0199","-0.1958","-0.0208","-0.251","-0.3255","-0.5356","-0.0271","-0.4271","0.0913","-0.016","-0.1383","0.0671","-0.0342","0.1497","-0.104","-0.0121","-0.2403"
"5601","Wadding of textile materials and articles thereof; textile fibers, not exceeding 5 mm in length (flock), textile dust and mill neps","-0.0866","-0.1927","0.1358","-0.1722","-0.1395","-0.1654","-0.4406","-0.4871","-0.2029","-0.1712","-0.0196","-0.376","-0.3289","-0.2152","-0.0417","-0.5376","-0.3227","0.1315","-0.225","-0.3905","-0.0914","-0.0186","-0.0184","0.0776","-0.0344"
"5602","Felt, whether or not impregnated, coated, covered or laminated","0.7097","0.7557","0.6355","0.378","0.5092","0.602","0.689","0.1875","0.32","0.5975","0.3143","0.363","0.5923","0.7479","0.7833","1.0907","1.0989","1.0836","0.9275","1.0143","1.4746","1.0866","1.1601","1.3549","1.0485"
"5603","Nonwovens, whether or not impregnated, coated, covered or laminated","0.9759","1.1091","1.0931","1.2355","0.8994","0.9785","1.0625","0.9458","0.8719","0.9561","0.8265","0.8708","1.0314","0.9826","1.3827","1.0076","1.2616","1.2904","1.3427","1.1679","1.27","0.9218","0.9533","1.0158","1.2448"
"5604","Rubber thread and cord, textile covered; textile yarn, and strip and the like of heading 5404 or 5405, impregnated, coated, covered or sheathed with rubber or plastics","0.5232","0.5365","0.6257","0.154","0.2095","0.2038","0.2689","0.1361","0.312","-0.1107","0.1385","0.053","-0.1479","-0.438","-0.5969","-0.5322","-0.5204","-0.5082","-0.1932","0.2412","-0.1481","-0.4896","-0.1886","3.2283","1.3361"
"5605","Metalized yarn, whether or not gimped, being textile yarn, or strip or the like of heading 5404 or 5405, combined with metal in the form of thread, strip or powder or covered with metal:","0.5947","0.8693","0.3728","0.633","0.3936","0.6695","0.9492","1.4017","1.0265","0.4796","0.6064","0.6557","0.658","0.5948","0.1646","0.2565","0.4306","0.3541","0.3255","0.5","0.8412","0.0751","0.5206","0.6527","0.9351"
"5606","Gimp yarn & strip, synthetic or artificial monofilament","0.6901","0.6225","0.8805","0.697","0.6541","0.5952","0.793","0.6808","0.4865","0.4774","0.5577","0.557","0.4085","0.255","0.2511","0.3284","0.2945","0.5184","0.3393","0.5258","0.944","0.9906","0.2773","0.65","0.7962"
"5607","Twine, cordage, ropes and cables, whether or not plaited or braided and whether or not impregnated, coated, covered or sheathed with rubber or plastics","-0.6908","-0.5946","-0.6498","-0.7011","-0.6619","-0.7931","-0.6707","-0.633","-0.6051","-0.6826","-0.5584","-0.7317","-0.7022","-0.9636","-0.8787","-1.0488","-0.957","-0.9567","-1.1302","-1.0912","-1.0579","-1.0501","-1.0335","-0.8658","-1.0328"
"5608","Knotted netting of twine, cordage or rope; made up fishing nets and other made up nets, of textile materials","-0.8459","-0.6707","-0.7648","-0.6406","-0.7455","-0.8553","-0.3624","-0.5774","-0.73","-0.8414","-0.8945","-1.0528","-0.7775","-0.704","-1.2101","-1.2223","-0.9081","-1.0446","-1.1419","-0.9369","-0.8962","-0.851","-0.9901","-1.0553","-1.1304"
"5609","Articles of yarn, strip or the like of heading 5404 or 5405, twine, cordage, rope or cables, not elsewhere specified or included:","-0.7843","-0.4926","-0.4888","-0.4784","-0.459","-0.5322","-0.5808","-0.4636","-0.6611","-0.5052","-0.6243","-0.3623","-0.8776","-0.6164","-0.9547","-0.8748","-1.0063","-1.0231","-0.7802","-0.853","-0.8856","-1.1911","-1.3931","-0.9167","-1.1047"
"5701","Carpets and other textile floor coverings, knotted, whether or not made up","-0.9171","-1.2067","-1.4122","-1.2185","-1.3645","-0.9042","-1.2516","-1.3565","-1.4314","-1.3957","-1.3155","-1.3563","-1.4136","-1.4625","-1.6197","-1.4033","-1.569","-1.4094","-1.3035","-1.1765","-1.3206","-1.5614","-1.2636","-1.4495","-1.647"
"5702","Carpets and other textile floor coverings, woven, not tufted or flocked, whether or not made up, including Kelem, Schumacks, Karamanie and similar hand-woven rugs","-0.8559","-0.9645","-0.7959","-0.9751","-0.9685","-0.8167","-1.0885","-0.9544","-1.1855","-1.2086","-0.9822","-0.5277","-0.5178","-0.5089","-0.5951","-0.7995","-0.804","-0.9538","-0.9131","-0.8367","-0.8479","-0.9988","-0.6828","-0.9621","-0.9517"
"5703","Carpets and other textile floor coverings, tufted, whether or not made up","0.2052","0.5822","0.5347","0.4142","0.2023","0.315","0.3066","0.2758","-0.0395","0.205","0.1355","0.1815","0.2409","0.0418","0.069","0.0119","0.1676","0.108","-0.0117","-0.484","0.11","-0.2919","0.2969","-0.5502","0.3653"
"5704","Carpets and other textile floor coverings, of felt, not tufted or flocked, whether or not made up","0.3367","0.3444","0.2096","0.393","0.4134","0.4097","0.339","0.0663","0.1332","0.2481","0.4674","0.3741","0.3929","0.5391","0.3546","-0.1279","-0.2496","0.2389","0.4517","0.6926","0.5438","0.3941","0.337","0.6647","0.3731"
"5705","Other carpets and other textile floor coverings, whether or not made up:","-0.6603","-0.8513","-0.5077","-0.4345","-0.4803","-0.6293","-0.5405","-0.703","-0.4318","-0.0284","-0.2684","-0.7883","-0.4187","-0.5233","-0.7149","-0.527","-0.7887","-0.5574","-0.5375","-0.4024","-0.5032","-0.0653","-0.215","-0.5859","-0.3987"
"5801","Woven pile fabrics and chenille fabrics, other than fabrics of heading 5802 or 5806","0.2558","0.4262","0.7938","0.7602","-0.0748","0.0776","-0.0952","0.1897","0.1947","-0.077","0.0358","0.4651","-0.1923","0.0227","-0.1357","0.0305","0.0772","-0.0236","-0.045","-0.0368","0.1939","0.2763","-0.2062","-0.1364","-0.289"
"5802","Terry toweling and similar woven terry fabrics, other than narrow fabrics of heading 5806; tufted textile fabrics, other than products of heading 5703","-0.8393","-1.0193","-0.9891","-0.9951","-0.9883","-0.9532","-1.1074","-0.8964","-1.0333","-1.1862","-1.1526","-0.5607","-1.1869","-0.6885","-0.9739","-0.8039","-0.7239","-0.6902","-0.2454","-0.4063","-0.4331","-0.5225","-0.7031","-0.6064","-0.7096"
"5803","Gauze, other than narrow fabrics of heading 5806:","0.0396","-0.3503","-0.1916","-0.1702","-0.3586","-0.0049","0.0246","-0.3395","0.1567","-0.2286","0.0884","-0.293","0.2244","-0.3207","-0.2283","-0.6644","-0.5532","-0.2526","-0.6166","-0.1253","-0.3917","0.0656","-0.2892","-0.2643","0.1194"
"5804","Tulles and other net fabrics, not including woven, knitted or crocheted fabrics; lace in the piece, in strips or in motifs, other than fabrics of headings 6002 to 6006","-0.2776","-0.2004","-0.2992","-0.7812","-0.2351","-0.2148","-0.5958","-0.3046","-0.6075","-0.7702","-0.7262","-0.64","-0.8712","-0.8874","-0.9815","-0.7165","-1.1066","-0.8535","-0.4961","-0.1381","-0.7005","-0.6843","-1.102","-0.7212","-0.7037"
"5805","Hand-woven tapestries of the type Gobelins, Flanders, Aubusson, Beauvais and the like, and needle-worked tapestries (for example, petit point, cross stitch), whether or not made up:","-0.1251","-0.0776","-0.2588","-0.6201","-0.2197","-0.3955","-0.4835","-0.5248","-1.0445","-0.7528","-0.1801","-1.0917","-1.2588","-0.6642","-0.9251","-1.0957","-0.4366","-0.4332","-0.6101","-0.9352","-0.7447","-0.9083","-1.0301","-0.7922","-0.762"
